age,workclass,education,marital-status,occupation,relationship,race,sex,capital-gain,capital-loss,hours-per-week,native-country,Probability
25-60, Private, HS-grad, Married-civ-spouse, Machine-op-inspct, Wife, Black, Female,≤5000,>40,<40, United-States, <=50K
25-60, Private, Assoc-acdm, Divorced, Exec-managerial, Unmarried, Black, Female,≤5000,≤40,40-60, Jamaica, <=50K
<25, Private, 9th, Married-civ-spouse, Machine-op-inspct, Husband, White, Male,≤5000,≤40,<40, United-States, <=50K
25-60, Private, Some-college, Married-civ-spouse, Prof-specialty, Wife, White, Female,≤5000,≤40,<40, United-States, >50K
25-60, Private, 10th, Married-civ-spouse, Machine-op-inspct, Wife, Black, Female,≤5000,≤40,<40, United-States, <=50K
25-60, Private, HS-grad, Married-civ-spouse, Sales, Wife, Black, Female,≤5000,>40,<40, United-States, >50K
