age,workclass,education,marital-status,occupation,relationship,race,sex,capital-gain,capital-loss,hours-per-week,native-country,Probability
25-60, Private, 9th, Married-civ-spouse, Handlers-cleaners, Husband, White, Male,≤5000,≤40,<40, United-States, <=50K
25-60, Federal-gov, Assoc-voc, Married-civ-spouse, Adm-clerical, Husband, White, Male,≤5000,≤40,40-60, United-States, >50K
<25, Private, 9th, Married-civ-spouse, Handlers-cleaners, Husband, White, Male,≤5000,≤40,<40, United-States, <=50K
25-60, Private, 9th, Married-civ-spouse, Handlers-cleaners, Husband, White, Male,≤5000,≤40,40-60, United-States, <=50K
25-60, Private, 10th, Married-civ-spouse, Handlers-cleaners, Other-relative, White, Male,≤5000,≤40,<40, United-States, <=50K
25-60, Private, HS-grad, Married-civ-spouse, Handlers-cleaners, Husband, White, Male,≤5000,≤40,<40, United-States, <=50K
