age,workclass,education,marital-status,occupation,relationship,race,sex,capital-gain,capital-loss,hours-per-week,native-country,Probability
25-60, Private, Prof-school, Never-married, Prof-specialty, Other-relative, Asian-Pac-Islander, Female,≤5000,>40,<40, China, <=50K
25-60, Self-emp-not-inc, Assoc-voc, Never-married, Adm-clerical, Not-in-family, White, Female,≤5000,≤40,40-60, United-States, <=50K
25-60, Private, HS-grad, Married-civ-spouse, Craft-repair, Husband, White, Male,≤5000,≤40,<40, United-States, <=50K
25-60, Private, Masters, Never-married, Prof-specialty, Not-in-family, Asian-Pac-Islander, Female,≤5000,≤40,<40, China, <=50K
25-60, Private, Some-college, Divorced, Exec-managerial, Not-in-family, White, Male,≤5000,≤40,<40, United-States, <=50K
25-60, Private, HS-grad, Never-married, Machine-op-inspct, Not-in-family, White, Male,≤5000,≤40,<40, Japan, <=50K
