age,workclass,education,marital-status,occupation,relationship,race,sex,capital-gain,capital-loss,hours-per-week,native-country,Probability
25-60, Private, 10th, Widowed, Other-service, Not-in-family, White, Female,≤5000,≤40,<40, United-States, <=50K
25-60, Private, Some-college, Widowed, Other-service, Not-in-family, White, Female,≤5000,≤40,<40, United-States, <=50K
<25, Private, 11th, Never-married, Prof-specialty, Own-child, White, Male,≤5000,≤40,<40, United-States, <=50K
>60, Private, 7th-8th, Married-spouse-absent, Other-service, Not-in-family, White, Female,≤5000,≤40,<40, United-States, <=50K
25-60, Private, HS-grad, Married-civ-spouse, Transport-moving, Husband, White, Male,≤5000,≤40,40-60, United-States, <=50K
25-60, Private, 12th, Married-civ-spouse, Handlers-cleaners, Husband, White, Male,≤5000,≤40,<40, United-States, <=50K
