age,workclass,education,marital-status,occupation,relationship,race,sex,capital-gain,capital-loss,hours-per-week,native-country,Probability
25-60, Private, Some-college, Never-married, Exec-managerial, Own-child, Asian-Pac-Islander, Female,≤5000,≤40,<40, United-States, <=50K
25-60, Private, HS-grad, Married-civ-spouse, Craft-repair, Husband, Amer-Indian-Eskimo, Male,≤5000,≤40,<40, United-States, <=50K
25-60, Private, 7th-8th, Married-civ-spouse, Machine-op-inspct, Husband, Black, Male,>5000,≤40,<40, Haiti, >50K
25-60, Private, Some-college, Never-married, Adm-clerical, Own-child, Black, Female,≤5000,≤40,<40, United-States, <=50K
25-60, State-gov, Assoc-acdm, Never-married, Tech-support, Not-in-family, White, Male,≤5000,≤40,40-60, United-States, <=50K
<25, Private, Some-college, Never-married, Adm-clerical, Not-in-family, White, Male,≤5000,≤40,<40, United-States, <=50K
