age,workclass,education,marital-status,occupation,relationship,race,sex,capital-gain,capital-loss,hours-per-week,native-country,Probability
25-60, State-gov, HS-grad, Married-civ-spouse, Protective-serv, Husband, White, Male,≤5000,≤40,40-60, United-States, <=50K
25-60, Local-gov, Assoc-acdm, Married-civ-spouse, Adm-clerical, Wife, White, Female,≤5000,≤40,<40, Puerto-Rico, <=50K
25-60, Private, HS-grad, Divorced, Adm-clerical, Not-in-family, White, Female,≤5000,≤40,<40, United-States, <=50K
25-60, State-gov, HS-grad, Married-civ-spouse, Protective-serv, Husband, White, Male,≤5000,≤40,<40, United-States, <=50K
25-60, State-gov, HS-grad, Married-civ-spouse, Protective-serv, Husband, White, Male,≤5000,≤40,<40, United-States, <=50K
25-60, Federal-gov, HS-grad, Married-civ-spouse, Protective-serv, Husband, White, Male,≤5000,≤40,40-60, United-States, >50K
