age,workclass,education,marital-status,occupation,relationship,race,sex,capital-gain,capital-loss,hours-per-week,native-country,Probability
25-60, Private, HS-grad, Married-spouse-absent, Craft-repair, Other-relative, White, Male,≤5000,≤40,<40, Poland, <=50K
>60, Private, Bachelors, Married-civ-spouse, Exec-managerial, Husband, White, Male,≤5000,≤40,40-60, United-States, >50K
25-60, Private, 12th, Married-civ-spouse, Transport-moving, Husband, White, Male,≤5000,≤40,<40, United-States, <=50K
<25, Private, Some-college, Never-married, Machine-op-inspct, Own-child, White, Female,≤5000,≤40,<40, United-States, <=50K
25-60, Private, HS-grad, Married-spouse-absent, Craft-repair, Unmarried, White, Male,≤5000,≤40,<40, Columbia, <=50K
25-60, Private, HS-grad, Divorced, Machine-op-inspct, Not-in-family, White, Female,≤5000,≤40,<40, United-States, <=50K
