age,workclass,education,marital-status,occupation,relationship,race,sex,capital-gain,capital-loss,hours-per-week,native-country,Probability
25-60, Private, 11th, Divorced, Adm-clerical, Not-in-family, White, Female,≤5000,≤40,<40, United-States, <=50K
25-60, Private, Bachelors, Married-civ-spouse, Exec-managerial, Husband, White, Male,≤5000,≤40,<40, United-States, >50K
25-60, Private, Bachelors, Never-married, Sales, Not-in-family, White, Female,≤5000,>40,40-60, United-States, <=50K
25-60, Private, HS-grad, Married-civ-spouse, Adm-clerical, Wife, White, Female,≤5000,≤40,<40, United-States, <=50K
<25, Private, Some-college, Never-married, Handlers-cleaners, Own-child, White, Male,≤5000,≤40,<40, United-States, <=50K
25-60, Private, 10th, Divorced, Protective-serv, Not-in-family, White, Female,≤5000,≤40,<40, United-States, <=50K
