age,workclass,education,marital-status,occupation,relationship,race,sex,capital-gain,capital-loss,hours-per-week,native-country,Probability
<25, Self-emp-inc, 10th, Never-married, Other-service, Own-child, White, Male,≤5000,≤40,<40, United-States, <=50K
25-60, Private, 11th, Never-married, Other-service, Other-relative, Asian-Pac-Islander, Male,≤5000,≤40,<40, United-States, <=50K
25-60, Private, Prof-school, Married-civ-spouse, Prof-specialty, Husband, White, Male,≤5000,≤40,40-60, United-States, >50K
25-60, Private, Some-college, Married-civ-spouse, Transport-moving, Husband, White, Male,≤5000,>40,<40, United-States, >50K
>60, Private, Some-college, Married-civ-spouse, Tech-support, Husband, White, Male,≤5000,≤40,<40, United-States, <=50K
25-60, Private, Bachelors, Never-married, Sales, Not-in-family, White, Female,≤5000,≤40,40-60, United-States, <=50K
