age,workclass,education,marital-status,occupation,relationship,race,sex,capital-gain,capital-loss,hours-per-week,native-country,Probability
<25, Private, Masters, Never-married, Exec-managerial, Own-child, White, Female,≤5000,≤40,40-60, United-States, <=50K
25-60, Self-emp-not-inc, Assoc-acdm, Married-civ-spouse, Exec-managerial, Husband, White, Male,≤5000,≤40,>60, United-States, >50K
<25, Private, 10th, Never-married, Adm-clerical, Own-child, White, Female,≤5000,≤40,<40, United-States, <=50K
<25, Private, Masters, Never-married, Prof-specialty, Own-child, White, Female,≤5000,≤40,<40, United-States, <=50K
<25, Private, Bachelors, Never-married, Exec-managerial, Own-child, White, Female,≤5000,≤40,<40, United-States, <=50K
<25, Private, 11th, Never-married, Exec-managerial, Own-child, White, Female,≤5000,≤40,<40, United-States, <=50K
