age,workclass,education,marital-status,occupation,relationship,race,sex,capital-gain,capital-loss,hours-per-week,native-country,Probability
25-60, State-gov, Bachelors, Divorced, Exec-managerial, Not-in-family, White, Male,≤5000,≤40,40-60, United-States, <=50K
25-60, State-gov, Bachelors, Married-civ-spouse, Exec-managerial, Husband, White, Male,≤5000,≤40,40-60, United-States, >50K
25-60, State-gov, Bachelors, Never-married, Exec-managerial, Not-in-family, White, Female,≤5000,≤40,40-60, United-States, <=50K
25-60, Federal-gov, Bachelors, Never-married, Exec-managerial, Not-in-family, White, Male,≤5000,≤40,40-60, United-States, <=50K
25-60, Private, Bachelors, Divorced, Exec-managerial, Not-in-family, White, Male,≤5000,≤40,40-60, United-States, <=50K
25-60, State-gov, Masters, Divorced, Exec-managerial, Not-in-family, White, Male,≤5000,≤40,40-60, United-States, <=50K
