age,workclass,education,marital-status,occupation,relationship,race,sex,capital-gain,capital-loss,hours-per-week,native-country,Probability
25-60, Private, 11th, Never-married, Craft-repair, Not-in-family, White, Male,≤5000,≤40,<40, United-States, <=50K
25-60, Private, Assoc-acdm, Never-married, Sales, Own-child, White, Female,≤5000,≤40,<40, United-States, <=50K
25-60, Private, 11th, Divorced, Craft-repair, Not-in-family, White, Male,≤5000,≤40,<40, United-States, <=50K
25-60, Private, HS-grad, Never-married, Exec-managerial, Not-in-family, White, Female,≤5000,≤40,<40, United-States, <=50K
<25, Private, Assoc-voc, Married-civ-spouse, Craft-repair, Wife, White, Female,≤5000,≤40,<40, United-States, <=50K
25-60, Private, 11th, Divorced, Craft-repair, Not-in-family, White, Male,≤5000,≤40,<40, United-States, <=50K
