age,workclass,education,marital-status,occupation,relationship,race,sex,capital-gain,capital-loss,hours-per-week,native-country,Probability
25-60, Private, 1st-4th, Married-civ-spouse, Other-service, Husband, White, Male,≤5000,≤40,<40, Cuba, <=50K
>60, State-gov, HS-grad, Married-civ-spouse, Adm-clerical, Husband, White, Male,≤5000,≤40,<40, United-States, <=50K
>60, Private, 1st-4th, Married-civ-spouse, Other-service, Husband, White, Male,≤5000,≤40,<40, Mexico, <=50K
25-60, Private, Masters, Married-civ-spouse, Prof-specialty, Husband, Asian-Pac-Islander, Male,≤5000,≤40,<40, United-States, >50K
25-60, Private, Some-college, Never-married, Sales, Other-relative, White, Male,≤5000,≤40,<40, United-States, <=50K
25-60, Private, Bachelors, Married-civ-spouse, Other-service, Husband, White, Male,≤5000,≤40,<40, United-States, <=50K
