age,workclass,education,marital-status,occupation,relationship,race,sex,capital-gain,capital-loss,hours-per-week,native-country,Probability
25-60, Private, Prof-school, Never-married, Prof-specialty, Other-relative, White, Female,≤5000,≤40,<40, United-States, <=50K
>60, Private, 5th-6th, Married-civ-spouse, Other-service, Husband, White, Male,≤5000,≤40,<40, United-States, <=50K
25-60, Private, 5th-6th, Married-civ-spouse, Craft-repair, Husband, White, Male,≤5000,≤40,<40, Mexico, <=50K
25-60, Local-gov, Masters, Married-civ-spouse, Exec-managerial, Husband, White, Male,≤5000,≤40,40-60, United-States, >50K
25-60, Private, HS-grad, Divorced, Tech-support, Not-in-family, White, Female,≤5000,≤40,<40, United-States, <=50K
25-60, Local-gov, Assoc-acdm, Married-civ-spouse, Exec-managerial, Husband, White, Male,≤5000,>40,<40, United-States, >50K
