age,workclass,education,marital-status,occupation,relationship,race,sex,capital-gain,capital-loss,hours-per-week,native-country,Probability
25-60, Local-gov, Assoc-acdm, Never-married, Prof-specialty, Own-child, Black, Male,≤5000,≤40,<40, United-States, <=50K
<25, Private, Bachelors, Never-married, Prof-specialty, Not-in-family, White, Male,≤5000,≤40,<40, United-States, <=50K
<25, Private, Bachelors, Never-married, Adm-clerical, Own-child, White, Female,≤5000,≤40,<40, United-States, <=50K
<25, Private, Assoc-acdm, Divorced, Other-service, Not-in-family, White, Female,≤5000,≤40,<40, United-States, <=50K
25-60, Local-gov, Bachelors, Married-civ-spouse, Prof-specialty, Wife, White, Female,≤5000,≤40,<40, United-States, >50K
25-60, Self-emp-not-inc, Some-college, Married-civ-spouse, Craft-repair, Husband, White, Male,≤5000,≤40,<40, United-States, <=50K
