age,workclass,education,marital-status,occupation,relationship,race,sex,capital-gain,capital-loss,hours-per-week,native-country,Probability
25-60, State-gov, Some-college, Married-civ-spouse, Protective-serv, Husband, White, Male,≤5000,≤40,<40, United-States, <=50K
25-60, State-gov, Some-college, Married-civ-spouse, Protective-serv, Husband, White, Male,≤5000,≤40,<40, United-States, <=50K
25-60, Private, Some-college, Divorced, Other-service, Unmarried, White, Female,≤5000,≤40,40-60, United-States, <=50K
25-60, State-gov, Some-college, Married-civ-spouse, Protective-serv, Husband, White, Male,≤5000,≤40,<40, United-States, <=50K
25-60, Private, Assoc-voc, Married-civ-spouse, Exec-managerial, Husband, White, Male,≤5000,≤40,40-60, United-States, >50K
>60, Private, Some-college, Married-civ-spouse, Protective-serv, Husband, White, Male,≤5000,≤40,<40, United-States, <=50K
