age,workclass,education,marital-status,occupation,relationship,race,sex,capital-gain,capital-loss,hours-per-week,native-country,Probability
<25, Private, Bachelors, Married-spouse-absent, Adm-clerical, Own-child, Black, Female,≤5000,≤40,<40, United-States, <=50K
<25, Private, Some-college, Never-married, Adm-clerical, Own-child, White, Female,≤5000,≤40,<40, United-States, <=50K
<25, Private, Bachelors, Never-married, Adm-clerical, Own-child, Black, Female,≤5000,≤40,<40, United-States, <=50K
25-60, Private, Bachelors, Divorced, Adm-clerical, Unmarried, White, Female,≤5000,≤40,<40, United-States, <=50K
25-60, Private, 11th, Never-married, Craft-repair, Not-in-family, White, Female,≤5000,≤40,<40, United-States, <=50K
<25, Private, Bachelors, Never-married, Sales, Own-child, Black, Female,≤5000,≤40,<40, United-States, <=50K
