age,workclass,education,marital-status,occupation,relationship,race,sex,capital-gain,capital-loss,hours-per-week,native-country,Probability
<25, Private, HS-grad, Never-married, Farming-fishing, Not-in-family, White, Male,≤5000,≤40,<40, Cuba, <=50K
<25, Private, HS-grad, Never-married, Farming-fishing, Not-in-family, White, Male,≤5000,≤40,<40, United-States, <=50K
<25, Private, HS-grad, Never-married, Adm-clerical, Not-in-family, White, Male,≤5000,≤40,<40, United-States, <=50K
25-60, Private, Masters, Married-civ-spouse, Adm-clerical, Husband, White, Male,≤5000,≤40,40-60, United-States, >50K
25-60, Private, Some-college, Married-civ-spouse, Handlers-cleaners, Husband, Other, Male,≤5000,≤40,<40, Mexico, <=50K
<25, Private, HS-grad, Never-married, Adm-clerical, Not-in-family, White, Male,≤5000,≤40,<40, United-States, <=50K
