age,workclass,education,marital-status,occupation,relationship,race,sex,capital-gain,capital-loss,hours-per-week,native-country,Probability
25-60, Local-gov, Masters, Divorced, Exec-managerial, Unmarried, White, Female,≤5000,≤40,<40, United-States, <=50K
25-60, Private, HS-grad, Separated, Craft-repair, Unmarried, White, Male,≤5000,≤40,<40, United-States, <=50K
25-60, Private, Masters, Divorced, Exec-managerial, Unmarried, White, Female,≤5000,≤40,<40, United-States, <=50K
25-60, Private, Masters, Divorced, Exec-managerial, Unmarried, White, Female,≤5000,≤40,<40, United-States, <=50K
25-60, Private, Some-college, Never-married, Other-service, Own-child, White, Female,≤5000,≤40,<40, United-States, <=50K
25-60, Local-gov, Assoc-acdm, Divorced, Adm-clerical, Unmarried, White, Female,≤5000,≤40,<40, United-States, <=50K
