age,workclass,education,marital-status,occupation,relationship,race,sex,capital-gain,capital-loss,hours-per-week,native-country,Probability
25-60, Private, 10th, Widowed, Sales, Unmarried, Black, Female,≤5000,≤40,<40, United-States, <=50K
25-60, Self-emp-inc, Bachelors, Married-civ-spouse, Sales, Husband, White, Male,≤5000,≤40,40-60, United-States, >50K
25-60, Self-emp-not-inc, HS-grad, Married-civ-spouse, Farming-fishing, Husband, White, Male,≤5000,≤40,40-60, United-States, <=50K
25-60, Private, HS-grad, Widowed, Adm-clerical, Unmarried, Black, Female,≤5000,≤40,<40, United-States, <=50K
25-60, Private, HS-grad, Divorced, Adm-clerical, Unmarried, Black, Female,≤5000,≤40,<40, United-States, <=50K
25-60, Private, HS-grad, Widowed, Other-service, Unmarried, Black, Female,≤5000,≤40,<40, United-States, <=50K
