age,workclass,education,marital-status,occupation,relationship,race,sex,capital-gain,capital-loss,hours-per-week,native-country,Probability
25-60, Private, HS-grad, Married-civ-spouse, Prof-specialty, Husband, Black, Male,≤5000,≤40,40-60, United-States, <=50K
25-60, Private, 9th, Married-civ-spouse, Machine-op-inspct, Husband, White, Male,≤5000,≤40,<40, United-States, <=50K
25-60, Private, Some-college, Divorced, Adm-clerical, Unmarried, White, Female,≤5000,>40,<40, United-States, <=50K
25-60, Private, HS-grad, Married-civ-spouse, Prof-specialty, Husband, White, Male,≤5000,≤40,40-60, United-States, <=50K
<25, Private, 11th, Never-married, Sales, Own-child, White, Male,≤5000,≤40,<40, United-States, <=50K
<25, Local-gov, HS-grad, Never-married, Transport-moving, Own-child, Black, Female,≤5000,≤40,<40, United-States, <=50K
