age,workclass,education,marital-status,occupation,relationship,race,sex,capital-gain,capital-loss,hours-per-week,native-country,Probability
25-60, Private, Some-college, Separated, Tech-support, Unmarried, Black, Female,≤5000,≤40,<40, United-States, <=50K
25-60, Private, Masters, Married-civ-spouse, Exec-managerial, Husband, White, Male,>5000,≤40,40-60, United-States, >50K
<25, Private, 11th, Never-married, Other-service, Own-child, White, Female,≤5000,≤40,<40, United-States, <=50K
25-60, Private, Some-college, Divorced, Prof-specialty, Not-in-family, White, Male,≤5000,≤40,<40, United-States, <=50K
<25, Federal-gov, 11th, Never-married, Adm-clerical, Unmarried, Black, Female,≤5000,≤40,<40, United-States, <=50K
>60, Private, Bachelors, Never-married, Prof-specialty, Own-child, White, Male,≤5000,≤40,<40, United-States, <=50K
