age,workclass,education,marital-status,occupation,relationship,race,sex,capital-gain,capital-loss,hours-per-week,native-country,Probability
25-60, Federal-gov, Assoc-voc, Never-married, Adm-clerical, Unmarried, White, Male,≤5000,≤40,40-60, United-States, <=50K
25-60, Private, 5th-6th, Married-civ-spouse, Craft-repair, Husband, White, Male,≤5000,≤40,<40, United-States, <=50K
25-60, Private, Assoc-voc, Never-married, Craft-repair, Unmarried, White, Male,≤5000,≤40,<40, United-States, <=50K
25-60, Private, HS-grad, Divorced, Other-service, Unmarried, Black, Female,≤5000,≤40,<40, United-States, <=50K
<25, Private, 12th, Never-married, Machine-op-inspct, Own-child, White, Male,≤5000,≤40,<40, United-States, <=50K
25-60, Private, Assoc-voc, Divorced, Adm-clerical, Unmarried, White, Female,≤5000,≤40,40-60, United-States, <=50K
