age,workclass,education,marital-status,occupation,relationship,race,sex,capital-gain,capital-loss,hours-per-week,native-country,Probability
25-60, Private, 11th, Divorced, Transport-moving, Unmarried, White, Male,≤5000,≤40,40-60, United-States, <=50K
25-60, Private, HS-grad, Married-civ-spouse, Transport-moving, Husband, White, Male,≤5000,≤40,<40, United-States, <=50K
25-60, Private, 11th, Married-civ-spouse, Transport-moving, Husband, White, Male,≤5000,≤40,40-60, United-States, <=50K
25-60, Private, 11th, Married-civ-spouse, Transport-moving, Husband, White, Male,≤5000,≤40,40-60, United-States, <=50K
25-60, Private, 11th, Married-civ-spouse, Transport-moving, Husband, White, Male,≤5000,≤40,40-60, United-States, <=50K
25-60, Private, 11th, Divorced, Farming-fishing, Unmarried, White, Male,≤5000,≤40,<40, United-States, <=50K
