age,workclass,education,marital-status,occupation,relationship,race,sex,capital-gain,capital-loss,hours-per-week,native-country,Probability
<25, Self-emp-not-inc, 9th, Married-civ-spouse, Craft-repair, Husband, White, Male,≤5000,≤40,40-60, United-States, <=50K
25-60, Private, Bachelors, Never-married, Sales, Own-child, White, Male,≤5000,≤40,<40, Germany, <=50K
25-60, Private, Bachelors, Never-married, Other-service, Own-child, White, Female,≤5000,≤40,<40, United-States, <=50K
<25, Private, HS-grad, Separated, Other-service, Own-child, White, Female,≤5000,≤40,<40, United-States, <=50K
25-60, Self-emp-not-inc, HS-grad, Married-civ-spouse, Sales, Husband, White, Male,≤5000,≤40,<40, United-States, <=50K
25-60, Private, Some-college, Never-married, Other-service, Own-child, White, Male,≤5000,≤40,40-60, United-States, <=50K
