age,workclass,education,marital-status,occupation,relationship,race,sex,capital-gain,capital-loss,hours-per-week,native-country,Probability
<25, Private, Some-college, Never-married, Prof-specialty, Own-child, White, Male,≤5000,≤40,<40, United-States, <=50K
25-60, Self-emp-not-inc, Doctorate, Married-civ-spouse, Prof-specialty, Husband, White, Male,≤5000,>40,>60, United-States, >50K
>60, Private, Bachelors, Married-civ-spouse, Exec-managerial, Wife, White, Female,≤5000,≤40,<40, United-States, >50K
25-60, Local-gov, Bachelors, Never-married, Prof-specialty, Not-in-family, White, Female,≤5000,≤40,40-60, United-States, <=50K
25-60, Private, Some-college, Never-married, Adm-clerical, Not-in-family, White, Male,≤5000,≤40,<40, United-States, <=50K
25-60, Private, HS-grad, Married-civ-spouse, Sales, Husband, White, Male,≤5000,≤40,<40, Mexico, <=50K
