age,workclass,education,marital-status,occupation,relationship,race,sex,capital-gain,capital-loss,hours-per-week,native-country,Probability
25-60, Private, Some-college, Widowed, Other-service, Unmarried, White, Female,≤5000,≤40,<40, United-States, <=50K
>60, Private, HS-grad, Divorced, Adm-clerical, Not-in-family, White, Female,≤5000,≤40,<40, United-States, <=50K
25-60, Private, Bachelors, Married-civ-spouse, Tech-support, Husband, White, Male,≤5000,>40,<40, United-States, >50K
25-60, Private, HS-grad, Never-married, Adm-clerical, Other-relative, White, Female,≤5000,≤40,40-60, United-States, <=50K
<25, Private, Bachelors, Never-married, Prof-specialty, Not-in-family, White, Male,≤5000,≤40,40-60, United-States, <=50K
25-60, Private, HS-grad, Married-civ-spouse, Craft-repair, Husband, White, Male,≤5000,≤40,<40, United-States, <=50K
