age,workclass,education,marital-status,occupation,relationship,race,sex,capital-gain,capital-loss,hours-per-week,native-country,Probability
<25, Private, 11th, Never-married, Other-service, Own-child, White, Male,≤5000,≤40,<40, Puerto-Rico, <=50K
25-60, Local-gov, Masters, Never-married, Prof-specialty, Own-child, White, Female,≤5000,≤40,<40, United-States, <=50K
25-60, Federal-gov, HS-grad, Married-civ-spouse, Adm-clerical, Husband, White, Male,>5000,≤40,40-60, United-States, >50K
25-60, Private, HS-grad, Married-civ-spouse, Exec-managerial, Wife, White, Female,≤5000,≤40,<40, United-States, >50K
25-60, Private, Bachelors, Widowed, Prof-specialty, Not-in-family, White, Female,≤5000,≤40,<40, United-States, <=50K
<25, Self-emp-not-inc, Some-college, Never-married, Adm-clerical, Own-child, White, Female,≤5000,≤40,<40, United-States, <=50K
