age,workclass,education,marital-status,occupation,relationship,race,sex,capital-gain,capital-loss,hours-per-week,native-country,Probability
25-60, Local-gov, Some-college, Divorced, Tech-support, Unmarried, White, Female,≤5000,≤40,<40, United-States, <=50K
<25, Private, Some-college, Married-civ-spouse, Handlers-cleaners, Husband, White, Male,≤5000,≤40,<40, United-States, <=50K
25-60, Local-gov, Some-college, Divorced, Adm-clerical, Unmarried, White, Female,≤5000,≤40,<40, United-States, <=50K
25-60, Local-gov, Some-college, Divorced, Adm-clerical, Unmarried, White, Female,≤5000,≤40,<40, United-States, <=50K
25-60, Private, Some-college, Separated, Machine-op-inspct, Not-in-family, White, Male,>5000,≤40,>60, United-States, >50K
25-60, Local-gov, Some-college, Divorced, Other-service, Unmarried, White, Female,≤5000,≤40,<40, United-States, <=50K
