age,workclass,education,marital-status,occupation,relationship,race,sex,capital-gain,capital-loss,hours-per-week,native-country,Probability
25-60, Private, 11th, Married-civ-spouse, Handlers-cleaners, Husband, White, Male,≤5000,≤40,<40, United-States, <=50K
25-60, State-gov, Assoc-acdm, Never-married, Adm-clerical, Not-in-family, Black, Male,≤5000,≤40,<40, United-States, <=50K
25-60, Private, Some-college, Separated, Other-service, Unmarried, Amer-Indian-Eskimo, Female,≤5000,≤40,<40, United-States, <=50K
25-60, Private, 11th, Married-civ-spouse, Craft-repair, Husband, White, Male,≤5000,≤40,<40, United-States, <=50K
25-60, Federal-gov, Assoc-voc, Married-civ-spouse, Adm-clerical, Husband, White, Male,≤5000,≤40,40-60, United-States, >50K
25-60, Private, HS-grad, Married-civ-spouse, Craft-repair, Husband, White, Male,≤5000,≤40,40-60, United-States, <=50K
