age,workclass,education,marital-status,occupation,relationship,race,sex,capital-gain,capital-loss,hours-per-week,native-country,Probability
25-60, Private, 1st-4th, Married-civ-spouse, Adm-clerical, Husband, White, Male,≤5000,≤40,40-60, Dominican-Republic, <=50K
25-60, Private, Some-college, Never-married, Sales, Other-relative, White, Male,≤5000,≤40,<40, United-States, <=50K
25-60, Private, Doctorate, Widowed, Tech-support, Unmarried, White, Male,≤5000,>40,<40, United-States, >50K
25-60, State-gov, HS-grad, Never-married, Adm-clerical, Own-child, Black, Female,≤5000,≤40,<40, United-States, <=50K
25-60, Private, 1st-4th, Married-civ-spouse, Handlers-cleaners, Husband, White, Male,≤5000,≤40,<40, El-Salvador, <=50K
25-60, Private, Assoc-voc, Married-civ-spouse, Adm-clerical, Husband, White, Male,≤5000,≤40,40-60, United-States, <=50K
