age,workclass,education,marital-status,occupation,relationship,race,sex,capital-gain,capital-loss,hours-per-week,native-country,Probability
25-60, Private, Some-college, Never-married, Other-service, Unmarried, Black, Female,≤5000,≤40,<40, United-States, <=50K
<25, Self-emp-not-inc, HS-grad, Never-married, Craft-repair, Unmarried, White, Male,≤5000,≤40,<40, United-States, <=50K
<25, Private, HS-grad, Never-married, Other-service, Not-in-family, White, Female,≤5000,≤40,<40, United-States, <=50K
<25, Private, Assoc-voc, Never-married, Sales, Own-child, White, Female,≤5000,≤40,<40, United-States, <=50K
25-60, Private, HS-grad, Divorced, Sales, Not-in-family, White, Female,≤5000,≤40,<40, United-States, <=50K
25-60, Private, HS-grad, Divorced, Craft-repair, Not-in-family, White, Male,≤5000,≤40,<40, United-States, <=50K
