age,workclass,education,marital-status,occupation,relationship,race,sex,capital-gain,capital-loss,hours-per-week,native-country,Probability
>60, Private, Assoc-voc, Married-civ-spouse, Machine-op-inspct, Husband, White, Male,≤5000,≤40,<40, United-States, <=50K
25-60, Private, Assoc-voc, Divorced, Tech-support, Not-in-family, White, Female,≤5000,≤40,<40, United-States, <=50K
25-60, Private, Assoc-voc, Married-civ-spouse, Adm-clerical, Husband, White, Male,≤5000,≤40,40-60, United-States, <=50K
<25, Local-gov, Bachelors, Never-married, Prof-specialty, Own-child, White, Female,≤5000,≤40,40-60, United-States, <=50K
25-60, Private, 5th-6th, Married-civ-spouse, Handlers-cleaners, Husband, White, Male,≤5000,≤40,<40, Mexico, <=50K
25-60, Private, HS-grad, Divorced, Adm-clerical, Unmarried, Black, Female,≤5000,≤40,40-60, United-States, <=50K
