age,workclass,education,marital-status,occupation,relationship,race,sex,capital-gain,capital-loss,hours-per-week,native-country,Probability
25-60, Federal-gov, Some-college, Separated, Prof-specialty, Not-in-family, White, Female,≤5000,≤40,<40, United-States, <=50K
25-60, Self-emp-not-inc, Bachelors, Married-civ-spouse, Sales, Husband, White, Male,≤5000,≤40,<40, United-States, <=50K
<25, Private, Bachelors, Never-married, Sales, Other-relative, Black, Male,≤5000,≤40,40-60, United-States, <=50K
25-60, Private, Some-college, Divorced, Machine-op-inspct, Own-child, White, Male,≤5000,≤40,<40, United-States, <=50K
25-60, Federal-gov, Some-college, Separated, Prof-specialty, Not-in-family, Black, Female,≤5000,≤40,<40, United-States, <=50K
<25, Private, HS-grad, Never-married, Machine-op-inspct, Own-child, White, Male,≤5000,≤40,<40, United-States, <=50K
