age,workclass,education,marital-status,occupation,relationship,race,sex,capital-gain,capital-loss,hours-per-week,native-country,Probability
25-60, Private, Assoc-acdm, Never-married, Adm-clerical, Not-in-family, White, Female,≤5000,≤40,40-60, United-States, <=50K
25-60, State-gov, HS-grad, Married-civ-spouse, Protective-serv, Husband, White, Male,≤5000,≤40,<40, United-States, <=50K
<25, Private, HS-grad, Never-married, Sales, Own-child, White, Female,≤5000,≤40,<40, Mexico, <=50K
25-60, Local-gov, Bachelors, Never-married, Tech-support, Not-in-family, White, Female,≤5000,≤40,<40, United-States, <=50K
25-60, Private, HS-grad, Married-civ-spouse, Exec-managerial, Husband, White, Male,≤5000,≤40,40-60, United-States, >50K
25-60, Private, Bachelors, Married-civ-spouse, Exec-managerial, Husband, White, Male,≤5000,≤40,40-60, United-States, >50K
