age,workclass,education,marital-status,occupation,relationship,race,sex,capital-gain,capital-loss,hours-per-week,native-country,Probability
25-60, Private, HS-grad, Married-civ-spouse, Machine-op-inspct, Husband, Asian-Pac-Islander, Male,≤5000,≤40,<40, Vietnam, <=50K
25-60, Self-emp-not-inc, Doctorate, Married-civ-spouse, Prof-specialty, Husband, White, Male,≤5000,≤40,40-60, United-States, >50K
25-60, Private, Bachelors, Divorced, Tech-support, Not-in-family, White, Female,≤5000,≤40,<40, United-States, <=50K
25-60, Private, HS-grad, Divorced, Adm-clerical, Unmarried, White, Female,≤5000,≤40,<40, United-States, <=50K
25-60, Private, HS-grad, Married-civ-spouse, Handlers-cleaners, Husband, Asian-Pac-Islander, Male,≤5000,>40,<40, Vietnam, <=50K
25-60, Private, HS-grad, Married-civ-spouse, Machine-op-inspct, Husband, White, Male,≤5000,≤40,<40, United-States, <=50K
