age,workclass,education,marital-status,occupation,relationship,race,sex,capital-gain,capital-loss,hours-per-week,native-country,Probability
25-60, Private, 12th, Divorced, Farming-fishing, Not-in-family, White, Male,≤5000,≤40,<40, United-States, <=50K
25-60, Private, Some-college, Divorced, Other-service, Unmarried, Black, Female,≤5000,≤40,<40, United-States, <=50K
25-60, Federal-gov, Masters, Married-civ-spouse, Exec-managerial, Other-relative, White, Male,>5000,≤40,<40, United-States, >50K
25-60, Private, 11th, Married-civ-spouse, Other-service, Wife, White, Female,≤5000,≤40,<40, United-States, <=50K
<25, State-gov, Some-college, Never-married, Prof-specialty, Own-child, White, Female,≤5000,≤40,<40, United-States, <=50K
<25, Private, HS-grad, Never-married, Sales, Own-child, White, Female,≤5000,≤40,<40, United-States, <=50K
