age,workclass,education,marital-status,occupation,relationship,race,sex,capital-gain,capital-loss,hours-per-week,native-country,Probability
<25, Private, 7th-8th, Never-married, Other-service, Own-child, Black, Male,≤5000,≤40,<40, United-States, <=50K
<25, Self-emp-not-inc, HS-grad, Married-civ-spouse, Sales, Husband, White, Male,≤5000,≤40,40-60, United-States, <=50K
<25, Private, Some-college, Never-married, Exec-managerial, Unmarried, White, Female,≤5000,≤40,<40, United-States, <=50K
25-60, Private, Bachelors, Never-married, Sales, Not-in-family, White, Male,≤5000,≤40,40-60, El-Salvador, <=50K
<25, State-gov, Some-college, Never-married, Handlers-cleaners, Own-child, White, Male,≤5000,≤40,<40, United-States, <=50K
<25, Private, HS-grad, Never-married, Other-service, Own-child, Black, Male,≤5000,≤40,<40, United-States, <=50K
