age,workclass,education,marital-status,occupation,relationship,race,sex,capital-gain,capital-loss,hours-per-week,native-country,Probability
<25, Private, 10th, Never-married, Handlers-cleaners, Own-child, Amer-Indian-Eskimo, Male,≤5000,≤40,<40, United-States, <=50K
<25, Private, Some-college, Never-married, Adm-clerical, Own-child, White, Female,≤5000,≤40,<40, United-States, <=50K
<25, Private, 10th, Never-married, Handlers-cleaners, Own-child, White, Male,≤5000,≤40,<40, United-States, <=50K
<25, Private, 10th, Never-married, Handlers-cleaners, Own-child, White, Male,≤5000,≤40,<40, United-States, <=50K
25-60, Private, Masters, Married-civ-spouse, Sales, Wife, Asian-Pac-Islander, Female,≤5000,≤40,<40, Japan, >50K
<25, Private, HS-grad, Never-married, Handlers-cleaners, Own-child, White, Male,≤5000,≤40,<40, United-States, <=50K
