age,workclass,education,marital-status,occupation,relationship,race,sex,capital-gain,capital-loss,hours-per-week,native-country,Probability
25-60, Private, Some-college, Married-civ-spouse, Handlers-cleaners, Husband, White, Male,≤5000,≤40,<40, Mexico, <=50K
25-60, Local-gov, Bachelors, Married-civ-spouse, Prof-specialty, Husband, White, Male,≤5000,≤40,40-60, United-States, >50K
<25, Private, Some-college, Never-married, Machine-op-inspct, Not-in-family, Asian-Pac-Islander, Male,≤5000,≤40,<40, Philippines, <=50K
25-60, Private, HS-grad, Never-married, Adm-clerical, Not-in-family, Black, Male,≤5000,≤40,<40, United-States, <=50K
25-60, Self-emp-inc, HS-grad, Married-civ-spouse, Exec-managerial, Husband, White, Male,≤5000,≤40,>60, United-States, >50K
>60, Self-emp-not-inc, 11th, Widowed, Exec-managerial, Not-in-family, White, Female,≤5000,≤40,>60, United-States, <=50K
