age,workclass,education,marital-status,occupation,relationship,race,sex,capital-gain,capital-loss,hours-per-week,native-country,Probability
25-60, State-gov, Some-college, Divorced, Craft-repair, Unmarried, White, Male,≤5000,≤40,<40, United-States, <=50K
25-60, State-gov, 10th, Never-married, Craft-repair, Unmarried, White, Male,≤5000,≤40,<40, United-States, <=50K
25-60, Private, Bachelors, Married-civ-spouse, Exec-managerial, Husband, White, Male,≤5000,≤40,40-60, United-States, >50K
25-60, Private, Assoc-voc, Married-civ-spouse, Sales, Husband, White, Male,≤5000,≤40,<40, United-States, <=50K
25-60, State-gov, Some-college, Divorced, Adm-clerical, Unmarried, White, Female,≤5000,≤40,<40, United-States, <=50K
25-60, Local-gov, Bachelors, Separated, Prof-specialty, Unmarried, White, Female,>5000,≤40,40-60, United-States, >50K
