age,workclass,education,marital-status,occupation,relationship,race,sex,capital-gain,capital-loss,hours-per-week,native-country,Probability
25-60, Private, Some-college, Never-married, Sales, Other-relative, White, Female,≤5000,≤40,<40, United-States, <=50K
25-60, Local-gov, Masters, Married-civ-spouse, Prof-specialty, Husband, White, Male,≤5000,≤40,<40, Italy, >50K
<25, Private, Some-college, Never-married, Sales, Other-relative, White, Female,≤5000,≤40,<40, United-States, <=50K
25-60, Self-emp-not-inc, Assoc-voc, Married-civ-spouse, Sales, Husband, White, Male,≤5000,≤40,<40, United-States, <=50K
25-60, Private, Some-college, Never-married, Adm-clerical, Other-relative, White, Female,≤5000,≤40,<40, United-States, <=50K
<25, Private, Some-college, Never-married, Adm-clerical, Own-child, White, Female,≤5000,≤40,<40, United-States, <=50K
