age,workclass,education,marital-status,occupation,relationship,race,sex,capital-gain,capital-loss,hours-per-week,native-country,Probability
<25, Self-emp-not-inc, HS-grad, Married-civ-spouse, Farming-fishing, Husband, White, Male,≤5000,≤40,>60, United-States, <=50K
25-60, Self-emp-not-inc, HS-grad, Married-civ-spouse, Farming-fishing, Husband, White, Male,≤5000,≤40,>60, United-States, <=50K
25-60, Private, 12th, Married-civ-spouse, Other-service, Husband, White, Male,≤5000,≤40,<40, United-States, <=50K
25-60, State-gov, Bachelors, Separated, Prof-specialty, Unmarried, White, Female,≤5000,≤40,<40, United-States, <=50K
25-60, Self-emp-not-inc, HS-grad, Married-civ-spouse, Farming-fishing, Husband, White, Male,≤5000,≤40,>60, United-States, <=50K
25-60, Private, Bachelors, Married-civ-spouse, Exec-managerial, Husband, White, Male,≤5000,>40,<40, Germany, >50K
