age,workclass,education,marital-status,occupation,relationship,race,sex,capital-gain,capital-loss,hours-per-week,native-country,Probability
<25, Self-emp-not-inc, HS-grad, Never-married, Other-service, Own-child, White, Female,≤5000,≤40,40-60, United-States, <=50K
<25, Self-emp-not-inc, HS-grad, Never-married, Other-service, Own-child, White, Female,≤5000,≤40,40-60, United-States, <=50K
25-60, Private, HS-grad, Divorced, Transport-moving, Not-in-family, White, Male,≤5000,≤40,40-60, United-States, <=50K
25-60, Private, HS-grad, Married-civ-spouse, Craft-repair, Husband, White, Male,≤5000,≤40,<40, United-States, <=50K
<25, Private, HS-grad, Never-married, Other-service, Own-child, White, Female,≤5000,≤40,<40, United-States, <=50K
<25, Self-emp-not-inc, HS-grad, Never-married, Other-service, Own-child, White, Male,≤5000,≤40,40-60, Yugoslavia, <=50K
