age,workclass,education,marital-status,occupation,relationship,race,sex,capital-gain,capital-loss,hours-per-week,native-country,Probability
<25, Local-gov, HS-grad, Divorced, Machine-op-inspct, Own-child, White, Male,≤5000,≤40,40-60, United-States, <=50K
25-60, Private, Some-college, Divorced, Adm-clerical, Not-in-family, White, Female,≤5000,≤40,<40, United-States, <=50K
25-60, Private, 5th-6th, Married-civ-spouse, Adm-clerical, Wife, White, Female,≤5000,≤40,<40, Italy, <=50K
25-60, Self-emp-not-inc, Bachelors, Married-civ-spouse, Sales, Husband, White, Male,>5000,≤40,40-60, United-States, >50K
<25, Private, HS-grad, Separated, Machine-op-inspct, Own-child, White, Male,≤5000,≤40,40-60, United-States, <=50K
25-60, Private, Bachelors, Never-married, Prof-specialty, Not-in-family, White, Male,≤5000,≤40,<40, United-States, <=50K
