age,workclass,education,marital-status,occupation,relationship,race,sex,capital-gain,capital-loss,hours-per-week,native-country,Probability
25-60, Self-emp-not-inc, 10th, Divorced, Other-service, Own-child, White, Female,≤5000,≤40,<40, United-States, <=50K
25-60, Self-emp-not-inc, HS-grad, Never-married, Other-service, Own-child, White, Female,≤5000,≤40,<40, United-States, <=50K
25-60, Self-emp-not-inc, Bachelors, Never-married, Other-service, Own-child, White, Female,≤5000,≤40,<40, United-States, <=50K
25-60, Self-emp-not-inc, Bachelors, Divorced, Other-service, Not-in-family, White, Female,≤5000,≤40,<40, United-States, <=50K
25-60, Private, Bachelors, Divorced, Other-service, Own-child, White, Female,≤5000,≤40,<40, United-States, <=50K
25-60, Private, Some-college, Divorced, Other-service, Own-child, White, Female,≤5000,≤40,<40, United-States, <=50K
