age,workclass,education,marital-status,occupation,relationship,race,sex,capital-gain,capital-loss,hours-per-week,native-country,Probability
<25, Private, HS-grad, Never-married, Handlers-cleaners, Own-child, White, Male,≤5000,≤40,<40, United-States, <=50K
25-60, Private, HS-grad, Never-married, Other-service, Not-in-family, White, Female,≤5000,≤40,40-60, United-States, <=50K
25-60, Private, HS-grad, Divorced, Adm-clerical, Not-in-family, White, Female,≤5000,≤40,40-60, United-States, <=50K
25-60, Private, 5th-6th, Married-civ-spouse, Other-service, Husband, White, Male,≤5000,≤40,<40, Mexico, <=50K
<25, Private, HS-grad, Never-married, Handlers-cleaners, Own-child, White, Male,≤5000,≤40,<40, United-States, <=50K
25-60, Self-emp-not-inc, Some-college, Married-civ-spouse, Craft-repair, Husband, White, Male,≤5000,≤40,<40, United-States, <=50K
