age,workclass,education,marital-status,occupation,relationship,race,sex,capital-gain,capital-loss,hours-per-week,native-country,Probability
25-60, Private, Some-college, Never-married, Adm-clerical, Own-child, White, Female,≤5000,≤40,<40, Nicaragua, <=50K
25-60, Private, 10th, Married-spouse-absent, Craft-repair, Not-in-family, White, Male,≤5000,≤40,40-60, United-States, <=50K
25-60, Private, Bachelors, Married-civ-spouse, Tech-support, Husband, White, Male,≤5000,>40,<40, United-States, >50K
<25, State-gov, Some-college, Never-married, Prof-specialty, Own-child, White, Male,≤5000,≤40,<40, United-States, <=50K
25-60, State-gov, Assoc-acdm, Never-married, Tech-support, Not-in-family, White, Male,≤5000,≤40,40-60, United-States, <=50K
<25, Private, HS-grad, Never-married, Machine-op-inspct, Own-child, White, Male,≤5000,≤40,<40, United-States, <=50K
