age,workclass,education,marital-status,occupation,relationship,race,sex,capital-gain,capital-loss,hours-per-week,native-country,Probability
<25, Private, Assoc-acdm, Never-married, Other-service, Own-child, White, Female,≤5000,≤40,<40, United-States, <=50K
25-60, Private, 1st-4th, Married-civ-spouse, Machine-op-inspct, Husband, White, Male,≤5000,≤40,<40, Mexico, <=50K
25-60, Private, HS-grad, Married-civ-spouse, Machine-op-inspct, Husband, White, Male,≤5000,≤40,40-60, United-States, <=50K
<25, Private, Assoc-acdm, Never-married, Adm-clerical, Own-child, White, Female,≤5000,≤40,<40, United-States, <=50K
<25, Private, Assoc-acdm, Never-married, Adm-clerical, Own-child, White, Female,≤5000,≤40,<40, United-States, <=50K
25-60, Private, Assoc-acdm, Never-married, Exec-managerial, Not-in-family, White, Female,≤5000,≤40,<40, United-States, <=50K
