age,workclass,education,marital-status,occupation,relationship,race,sex,capital-gain,capital-loss,hours-per-week,native-country,Probability
25-60, Private, Assoc-acdm, Divorced, Prof-specialty, Own-child, White, Female,≤5000,≤40,<40, United-States, <=50K
25-60, Private, Bachelors, Married-civ-spouse, Exec-managerial, Husband, White, Male,≤5000,≤40,<40, United-States, >50K
25-60, Private, Some-college, Never-married, Adm-clerical, Own-child, White, Female,≤5000,≤40,40-60, United-States, <=50K
25-60, Private, 9th, Married-civ-spouse, Craft-repair, Husband, White, Male,≤5000,≤40,<40, United-States, <=50K
25-60, Private, HS-grad, Married-civ-spouse, Craft-repair, Husband, White, Male,≤5000,≤40,<40, United-States, <=50K
<25, Private, Assoc-acdm, Divorced, Other-service, Not-in-family, White, Female,≤5000,≤40,<40, United-States, <=50K
