age,workclass,education,marital-status,occupation,relationship,race,sex,capital-gain,capital-loss,hours-per-week,native-country,Probability
25-60, Self-emp-not-inc, 11th, Divorced, Craft-repair, Not-in-family, White, Male,≤5000,≤40,40-60, United-States, <=50K
>60, Private, Some-college, Married-civ-spouse, Exec-managerial, Husband, White, Male,≤5000,≤40,<40, United-States, <=50K
<25, Private, 11th, Never-married, Other-service, Own-child, White, Male,≤5000,≤40,<40, United-States, <=50K
25-60, Local-gov, 11th, Never-married, Handlers-cleaners, Own-child, Black, Male,≤5000,≤40,<40, United-States, <=50K
25-60, State-gov, Doctorate, Divorced, Prof-specialty, Not-in-family, White, Female,≤5000,>40,<40, United-States, >50K
25-60, Private, Bachelors, Separated, Exec-managerial, Not-in-family, White, Male,≤5000,≤40,40-60, United-States, <=50K
