age,workclass,education,marital-status,occupation,relationship,race,sex,capital-gain,capital-loss,hours-per-week,native-country,Probability
<25, Self-emp-not-inc, 11th, Never-married, Farming-fishing, Own-child, White, Male,≤5000,≤40,<40, United-States, <=50K
25-60, Private, HS-grad, Never-married, Priv-house-serv, Other-relative, Black, Female,≤5000,≤40,<40, Honduras, <=50K
25-60, State-gov, Bachelors, Married-civ-spouse, Adm-clerical, Husband, White, Male,>5000,≤40,<40, United-States, >50K
25-60, Private, Assoc-voc, Divorced, Tech-support, Unmarried, White, Female,≤5000,≤40,<40, United-States, <=50K
25-60, Self-emp-not-inc, Masters, Divorced, Prof-specialty, Not-in-family, White, Female,≤5000,≤40,40-60, United-States, <=50K
25-60, Private, Some-college, Married-civ-spouse, Craft-repair, Husband, White, Male,≤5000,≤40,<40, United-States, <=50K
