age,workclass,education,marital-status,occupation,relationship,race,sex,capital-gain,capital-loss,hours-per-week,native-country,Probability
<25, Private, Some-college, Never-married, Adm-clerical, Unmarried, Asian-Pac-Islander, Female,≤5000,≤40,<40, United-States, <=50K
<25, Private, Some-college, Never-married, Farming-fishing, Not-in-family, White, Female,≤5000,≤40,<40, United-States, <=50K
25-60, Private, HS-grad, Separated, Craft-repair, Own-child, White, Male,≤5000,≤40,<40, United-States, <=50K
25-60, Private, HS-grad, Divorced, Sales, Not-in-family, White, Female,≤5000,≤40,<40, United-States, <=50K
<25, Private, Some-college, Never-married, Adm-clerical, Unmarried, White, Female,≤5000,≤40,<40, United-States, <=50K
<25, Private, 7th-8th, Married-civ-spouse, Machine-op-inspct, Husband, White, Male,≤5000,≤40,<40, United-States, <=50K
