age,workclass,education,marital-status,occupation,relationship,race,sex,capital-gain,capital-loss,hours-per-week,native-country,Probability
<25, Private, Some-college, Divorced, Adm-clerical, Other-relative, White, Female,≤5000,≤40,<40, United-States, <=50K
25-60, Private, Some-college, Divorced, Adm-clerical, Other-relative, White, Female,≤5000,≤40,<40, United-States, <=50K
<25, Private, Some-college, Married-civ-spouse, Adm-clerical, Other-relative, White, Female,≤5000,≤40,<40, United-States, <=50K
<25, Private, Some-college, Divorced, Tech-support, Other-relative, White, Female,≤5000,≤40,<40, United-States, <=50K
<25, Private, Some-college, Married-civ-spouse, Adm-clerical, Other-relative, White, Female,≤5000,≤40,<40, United-States, <=50K
<25, Private, Some-college, Never-married, Sales, Other-relative, White, Female,≤5000,≤40,<40, United-States, <=50K
