age,workclass,education,marital-status,occupation,relationship,race,sex,capital-gain,capital-loss,hours-per-week,native-country,Probability
25-60, Private, Some-college, Widowed, Sales, Unmarried, White, Female,≤5000,≤40,<40, United-States, <=50K
25-60, Private, Some-college, Widowed, Sales, Unmarried, White, Female,≤5000,≤40,<40, United-States, <=50K
>60, Self-emp-not-inc, 10th, Married-civ-spouse, Exec-managerial, Husband, White, Male,≤5000,≤40,<40, United-States, <=50K
25-60, Private, Some-college, Widowed, Adm-clerical, Unmarried, White, Female,≤5000,≤40,<40, United-States, <=50K
25-60, Private, Some-college, Divorced, Sales, Unmarried, White, Female,≤5000,≤40,<40, United-States, <=50K
25-60, Private, HS-grad, Widowed, Sales, Unmarried, White, Female,≤5000,≤40,<40, United-States, <=50K
