age,workclass,education,marital-status,occupation,relationship,race,sex,capital-gain,capital-loss,hours-per-week,native-country,Probability
25-60, Local-gov, HS-grad, Never-married, Other-service, Own-child, White, Male,≤5000,≤40,40-60, United-States, <=50K
<25, Private, Assoc-acdm, Never-married, Handlers-cleaners, Own-child, White, Male,≤5000,≤40,<40, United-States, <=50K
25-60, Private, HS-grad, Married-civ-spouse, Transport-moving, Husband, White, Male,≤5000,≤40,40-60, United-States, <=50K
25-60, Local-gov, Bachelors, Never-married, Other-service, Own-child, White, Male,≤5000,≤40,<40, United-States, <=50K
25-60, Private, Prof-school, Never-married, Prof-specialty, Not-in-family, White, Male,≤5000,>40,<40, United-States, >50K
25-60, Local-gov, HS-grad, Never-married, Adm-clerical, Own-child, White, Female,≤5000,≤40,<40, United-States, <=50K
