age,workclass,education,marital-status,occupation,relationship,race,sex,capital-gain,capital-loss,hours-per-week,native-country,Probability
25-60, Local-gov, Some-college, Married-civ-spouse, Craft-repair, Husband, White, Male,≤5000,≤40,<40, United-States, <=50K
>60, Self-emp-not-inc, Bachelors, Widowed, Sales, Not-in-family, White, Male,≤5000,≤40,<40, United-States, <=50K
25-60, Private, Assoc-acdm, Never-married, Adm-clerical, Other-relative, White, Male,≤5000,≤40,<40, United-States, <=50K
>60, Private, Assoc-voc, Married-civ-spouse, Adm-clerical, Husband, White, Male,≤5000,≤40,40-60, Canada, <=50K
>60, Private, HS-grad, Widowed, Exec-managerial, Not-in-family, White, Male,≤5000,≤40,<40, United-States, <=50K
25-60, Local-gov, Bachelors, Never-married, Tech-support, Not-in-family, White, Male,≤5000,≤40,<40, United-States, <=50K
