age,workclass,education,marital-status,occupation,relationship,race,sex,capital-gain,capital-loss,hours-per-week,native-country,Probability
<25, Private, Some-college, Never-married, Transport-moving, Own-child, Asian-Pac-Islander, Male,≤5000,≤40,<40, China, <=50K
25-60, Private, Some-college, Married-civ-spouse, Sales, Wife, White, Female,≤5000,≤40,<40, United-States, <=50K
<25, Private, Some-college, Never-married, Handlers-cleaners, Own-child, Asian-Pac-Islander, Male,≤5000,≤40,<40, Philippines, <=50K
25-60, Private, Some-college, Never-married, Prof-specialty, Not-in-family, White, Male,≤5000,≤40,<40, United-States, <=50K
25-60, State-gov, Masters, Never-married, Adm-clerical, Not-in-family, Black, Female,≤5000,≤40,40-60, United-States, <=50K
<25, Private, Some-college, Never-married, Adm-clerical, Own-child, Asian-Pac-Islander, Female,≤5000,≤40,<40, Philippines, <=50K
