age,workclass,education,marital-status,occupation,relationship,race,sex,capital-gain,capital-loss,hours-per-week,native-country,Probability
<25, Private, Bachelors, Never-married, Exec-managerial, Own-child, White, Female,≤5000,≤40,<40, United-States, <=50K
<25, Private, Some-college, Never-married, Other-service, Own-child, White, Female,≤5000,≤40,<40, United-States, <=50K
25-60, Private, 11th, Separated, Exec-managerial, Unmarried, White, Female,≤5000,≤40,<40, United-States, <=50K
<25, Private, Bachelors, Never-married, Exec-managerial, Own-child, White, Female,≤5000,≤40,<40, United-States, <=50K
<25, Private, Bachelors, Never-married, Adm-clerical, Own-child, White, Female,≤5000,≤40,<40, United-States, <=50K
>60, Self-emp-not-inc, HS-grad, Widowed, Sales, Not-in-family, White, Male,≤5000,≤40,<40, United-States, <=50K
