age,workclass,education,marital-status,occupation,relationship,race,sex,capital-gain,capital-loss,hours-per-week,native-country,Probability
<25, Private, Bachelors, Never-married, Other-service, Not-in-family, White, Female,≤5000,≤40,40-60, United-States, <=50K
25-60, Self-emp-not-inc, HS-grad, Married-civ-spouse, Exec-managerial, Husband, White, Male,≤5000,≤40,40-60, United-States, <=50K
25-60, Private, HS-grad, Divorced, Other-service, Not-in-family, White, Male,≤5000,≤40,<40, United-States, <=50K
<25, Private, Bachelors, Never-married, Adm-clerical, Not-in-family, White, Female,≤5000,≤40,40-60, United-States, <=50K
<25, Private, Bachelors, Never-married, Other-service, Not-in-family, White, Female,≤5000,≤40,<40, United-States, <=50K
25-60, Self-emp-not-inc, Bachelors, Divorced, Sales, Unmarried, Asian-Pac-Islander, Female,≤5000,≤40,<40, South, <=50K
