age,workclass,education,marital-status,occupation,relationship,race,sex,capital-gain,capital-loss,hours-per-week,native-country,Probability
25-60, Private, Some-college, Divorced, Handlers-cleaners, Unmarried, White, Female,≤5000,≤40,<40, United-States, <=50K
25-60, Private, Some-college, Divorced, Adm-clerical, Unmarried, White, Female,≤5000,≤40,<40, United-States, <=50K
25-60, Local-gov, HS-grad, Never-married, Prof-specialty, Not-in-family, White, Female,≤5000,≤40,<40, United-States, <=50K
>60, Private, Bachelors, Married-civ-spouse, Adm-clerical, Husband, White, Male,>5000,≤40,<40, United-States, >50K
25-60, Private, 10th, Divorced, Handlers-cleaners, Unmarried, White, Female,≤5000,≤40,<40, United-States, <=50K
25-60, Private, Some-college, Divorced, Adm-clerical, Unmarried, White, Female,≤5000,≤40,<40, United-States, <=50K
