age,workclass,education,marital-status,occupation,relationship,race,sex,capital-gain,capital-loss,hours-per-week,native-country,Probability
>60, Self-emp-not-inc, HS-grad, Widowed, Farming-fishing, Not-in-family, White, Male,≤5000,≤40,<40, United-States, <=50K
>60, Self-emp-not-inc, HS-grad, Widowed, Sales, Not-in-family, White, Male,≤5000,≤40,<40, United-States, <=50K
>60, Self-emp-not-inc, Bachelors, Widowed, Farming-fishing, Not-in-family, White, Male,≤5000,≤40,<40, United-States, <=50K
>60, Self-emp-not-inc, HS-grad, Widowed, Exec-managerial, Not-in-family, White, Male,≤5000,≤40,<40, United-States, <=50K
>60, Self-emp-not-inc, HS-grad, Widowed, Farming-fishing, Unmarried, White, Male,≤5000,≤40,<40, United-States, <=50K
>60, Self-emp-not-inc, 7th-8th, Widowed, Farming-fishing, Not-in-family, White, Male,≤5000,≤40,<40, United-States, <=50K
