age,workclass,education,marital-status,occupation,relationship,race,sex,capital-gain,capital-loss,hours-per-week,native-country,Probability
25-60, Private, Assoc-acdm, Married-civ-spouse, Other-service, Wife, White, Female,≤5000,≤40,<40, United-States, <=50K
25-60, Private, HS-grad, Married-civ-spouse, Craft-repair, Husband, White, Male,≤5000,>40,<40, United-States, >50K
25-60, State-gov, Some-college, Separated, Prof-specialty, Unmarried, White, Female,≤5000,≤40,<40, United-States, <=50K
25-60, Private, Assoc-acdm, Married-civ-spouse, Adm-clerical, Wife, White, Female,≤5000,≤40,<40, United-States, <=50K
25-60, Private, Assoc-acdm, Married-civ-spouse, Prof-specialty, Wife, White, Female,≤5000,≤40,<40, United-States, >50K
25-60, Private, 12th, Married-civ-spouse, Other-service, Wife, White, Female,≤5000,≤40,<40, United-States, <=50K
