age,workclass,education,marital-status,occupation,relationship,race,sex,capital-gain,capital-loss,hours-per-week,native-country,Probability
<25, Private, Bachelors, Never-married, Sales, Not-in-family, White, Male,≤5000,>40,40-60, United-States, <=50K
25-60, State-gov, Doctorate, Never-married, Prof-specialty, Not-in-family, White, Male,≤5000,>40,40-60, United-States, >50K
25-60, Self-emp-not-inc, Masters, Married-civ-spouse, Sales, Husband, White, Male,≤5000,≤40,40-60, United-States, >50K
25-60, Private, 11th, Never-married, Craft-repair, Unmarried, White, Male,≤5000,≤40,<40, United-States, <=50K
25-60, Private, Bachelors, Never-married, Sales, Not-in-family, White, Male,≤5000,>40,40-60, United-States, <=50K
>60, Self-emp-inc, Doctorate, Widowed, Prof-specialty, Not-in-family, White, Male,>5000,≤40,<40, United-States, >50K
