age,workclass,education,marital-status,occupation,relationship,race,sex,capital-gain,capital-loss,hours-per-week,native-country,Probability
25-60, Private, 12th, Divorced, Handlers-cleaners, Not-in-family, Black, Male,≤5000,≤40,<40, United-States, <=50K
<25, Private, HS-grad, Never-married, Other-service, Other-relative, White, Female,≤5000,≤40,<40, United-States, <=50K
25-60, Private, HS-grad, Divorced, Adm-clerical, Not-in-family, Black, Male,≤5000,≤40,<40, United-States, <=50K
25-60, Private, HS-grad, Never-married, Handlers-cleaners, Not-in-family, Black, Male,≤5000,≤40,<40, United-States, <=50K
25-60, Private, HS-grad, Never-married, Handlers-cleaners, Not-in-family, Black, Male,≤5000,≤40,<40, United-States, <=50K
25-60, Private, Some-college, Divorced, Adm-clerical, Not-in-family, Black, Male,≤5000,≤40,<40, United-States, <=50K
