age,workclass,education,marital-status,occupation,relationship,race,sex,capital-gain,capital-loss,hours-per-week,native-country,Probability
25-60, Private, 10th, Divorced, Transport-moving, Own-child, White, Male,≤5000,≤40,<40, United-States, <=50K
25-60, Private, Some-college, Widowed, Exec-managerial, Not-in-family, White, Female,≤5000,≤40,<40, United-States, <=50K
25-60, Private, HS-grad, Divorced, Machine-op-inspct, Unmarried, White, Female,≤5000,≤40,<40, United-States, <=50K
25-60, Private, 10th, Married-civ-spouse, Transport-moving, Husband, White, Male,≤5000,≤40,<40, United-States, <=50K
25-60, Private, HS-grad, Married-spouse-absent, Transport-moving, Own-child, White, Male,≤5000,≤40,<40, United-States, <=50K
25-60, Self-emp-inc, Bachelors, Married-civ-spouse, Sales, Husband, White, Male,≤5000,>40,40-60, United-States, >50K
