age,workclass,education,marital-status,occupation,relationship,race,sex,capital-gain,capital-loss,hours-per-week,native-country,Probability
25-60, Private, HS-grad, Married-civ-spouse, Farming-fishing, Husband, White, Male,≤5000,≤40,<40, United-States, <=50K
25-60, Private, HS-grad, Never-married, Machine-op-inspct, Unmarried, Black, Female,≤5000,≤40,<40, United-States, <=50K
25-60, Private, 5th-6th, Married-civ-spouse, Farming-fishing, Husband, White, Male,≤5000,≤40,40-60, Mexico, <=50K
25-60, State-gov, HS-grad, Married-civ-spouse, Machine-op-inspct, Husband, White, Male,≤5000,≤40,>60, United-States, <=50K
25-60, Private, HS-grad, Married-civ-spouse, Farming-fishing, Husband, White, Male,≤5000,≤40,<40, United-States, <=50K
25-60, Self-emp-inc, 10th, Married-civ-spouse, Exec-managerial, Husband, White, Male,≤5000,>40,40-60, United-States, >50K
