age,workclass,education,marital-status,occupation,relationship,race,sex,capital-gain,capital-loss,hours-per-week,native-country,Probability
25-60, Self-emp-not-inc, HS-grad, Married-spouse-absent, Farming-fishing, Unmarried, White, Male,≤5000,≤40,40-60, United-States, <=50K
25-60, Local-gov, Some-college, Married-civ-spouse, Machine-op-inspct, Husband, White, Male,>5000,≤40,<40, United-States, >50K
25-60, Self-emp-not-inc, HS-grad, Never-married, Farming-fishing, Unmarried, White, Male,≤5000,≤40,40-60, United-States, <=50K
25-60, Self-emp-not-inc, HS-grad, Married-civ-spouse, Farming-fishing, Husband, White, Male,≤5000,≤40,40-60, United-States, <=50K
25-60, Self-emp-not-inc, HS-grad, Married-civ-spouse, Farming-fishing, Husband, White, Male,≤5000,≤40,40-60, United-States, <=50K
25-60, Self-emp-not-inc, HS-grad, Married-civ-spouse, Farming-fishing, Husband, White, Male,≤5000,≤40,40-60, United-States, <=50K
