age,workclass,education,marital-status,occupation,relationship,race,sex,capital-gain,capital-loss,hours-per-week,native-country,Probability
25-60, State-gov, HS-grad, Married-civ-spouse, Other-service, Husband, White, Male,≤5000,≤40,<40, United-States, <=50K
25-60, Local-gov, Some-college, Never-married, Craft-repair, Own-child, White, Male,≤5000,≤40,<40, United-States, <=50K
25-60, Self-emp-not-inc, Doctorate, Married-civ-spouse, Prof-specialty, Husband, White, Male,>5000,≤40,40-60, United-States, >50K
25-60, Private, HS-grad, Divorced, Other-service, Unmarried, White, Female,≤5000,≤40,<40, United-States, <=50K
25-60, Private, Some-college, Married-civ-spouse, Sales, Husband, White, Male,≤5000,≤40,>60, United-States, >50K
25-60, State-gov, 7th-8th, Married-civ-spouse, Other-service, Husband, White, Male,≤5000,≤40,<40, United-States, <=50K
