age,workclass,education,marital-status,occupation,relationship,race,sex,capital-gain,capital-loss,hours-per-week,native-country,Probability
25-60, Private, Bachelors, Divorced, Prof-specialty, Not-in-family, White, Male,≤5000,≤40,40-60, United-States, <=50K
25-60, Local-gov, Masters, Married-civ-spouse, Exec-managerial, Husband, White, Male,≤5000,≤40,<40, United-States, >50K
25-60, Local-gov, Masters, Married-civ-spouse, Prof-specialty, Wife, Black, Female,≤5000,≤40,40-60, United-States, >50K
25-60, Private, Some-college, Married-civ-spouse, Machine-op-inspct, Husband, White, Male,≤5000,>40,40-60, United-States, >50K
25-60, Private, Assoc-acdm, Divorced, Sales, Not-in-family, White, Male,≤5000,≤40,<40, United-States, <=50K
25-60, Private, Bachelors, Divorced, Prof-specialty, Not-in-family, White, Female,≤5000,≤40,40-60, United-States, <=50K
