age,workclass,education,marital-status,occupation,relationship,race,sex,capital-gain,capital-loss,hours-per-week,native-country,Probability
<25, Private, 11th, Never-married, Craft-repair, Other-relative, White, Male,≤5000,≤40,<40, United-States, <=50K
<25, Private, HS-grad, Never-married, Craft-repair, Other-relative, White, Male,≤5000,≤40,<40, United-States, <=50K
<25, Private, 11th, Never-married, Sales, Other-relative, White, Male,≤5000,≤40,<40, United-States, <=50K
<25, Private, 9th, Never-married, Craft-repair, Other-relative, White, Male,≤5000,≤40,<40, United-States, <=50K
<25, Private, 11th, Never-married, Craft-repair, Own-child, White, Male,≤5000,≤40,<40, United-States, <=50K
<25, Private, 11th, Never-married, Craft-repair, Not-in-family, White, Male,≤5000,≤40,<40, United-States, <=50K
