age,workclass,education,marital-status,occupation,relationship,race,sex,capital-gain,capital-loss,hours-per-week,native-country,Probability
>60, Self-emp-inc, Some-college, Married-civ-spouse, Sales, Husband, White, Male,≤5000,≤40,40-60, United-States, <=50K
25-60, Private, HS-grad, Married-civ-spouse, Craft-repair, Husband, White, Male,≤5000,≤40,<40, United-States, <=50K
>60, Private, HS-grad, Divorced, Other-service, Other-relative, White, Female,≤5000,≤40,>60, United-States, <=50K
25-60, Private, Assoc-voc, Married-civ-spouse, Craft-repair, Husband, White, Male,≤5000,≤40,<40, United-States, <=50K
25-60, Self-emp-inc, Some-college, Divorced, Craft-repair, Not-in-family, White, Male,≤5000,≤40,<40, United-States, <=50K
25-60, Private, Bachelors, Married-civ-spouse, Adm-clerical, Wife, White, Female,≤5000,≤40,<40, United-States, >50K
