age,workclass,education,marital-status,occupation,relationship,race,sex,capital-gain,capital-loss,hours-per-week,native-country,Probability
25-60, Private, Some-college, Never-married, Exec-managerial, Not-in-family, White, Female,≤5000,≤40,40-60, United-States, <=50K
25-60, Private, Assoc-acdm, Married-civ-spouse, Adm-clerical, Wife, White, Female,≤5000,≤40,40-60, United-States, >50K
<25, Private, Some-college, Never-married, Other-service, Not-in-family, White, Female,≤5000,≤40,<40, United-States, <=50K
25-60, Local-gov, Bachelors, Married-civ-spouse, Protective-serv, Husband, White, Male,≤5000,≤40,40-60, United-States, >50K
<25, Private, Bachelors, Never-married, Exec-managerial, Not-in-family, White, Female,≤5000,≤40,<40, United-States, <=50K
<25, Private, HS-grad, Never-married, Sales, Other-relative, White, Female,≤5000,≤40,<40, United-States, <=50K
