age,workclass,education,marital-status,occupation,relationship,race,sex,capital-gain,capital-loss,hours-per-week,native-country,Probability
>60, Local-gov, HS-grad, Married-civ-spouse, Adm-clerical, Husband, White, Male,≤5000,≤40,<40, United-States, <=50K
25-60, Private, Bachelors, Married-civ-spouse, Adm-clerical, Husband, White, Male,≤5000,≤40,40-60, United-States, >50K
25-60, Private, Assoc-voc, Married-civ-spouse, Machine-op-inspct, Husband, White, Male,≤5000,≤40,<40, United-States, <=50K
<25, Private, HS-grad, Married-civ-spouse, Handlers-cleaners, Husband, White, Male,≤5000,≤40,40-60, United-States, <=50K
25-60, Private, HS-grad, Divorced, Craft-repair, Not-in-family, White, Male,≤5000,≤40,<40, United-States, <=50K
<25, Private, 5th-6th, Never-married, Machine-op-inspct, Other-relative, White, Male,≤5000,≤40,<40, Mexico, <=50K
