age,workclass,education,marital-status,occupation,relationship,race,sex,capital-gain,capital-loss,hours-per-week,native-country,Probability
25-60, Private, HS-grad, Never-married, Transport-moving, Not-in-family, White, Male,≤5000,≤40,>60, United-States, <=50K
25-60, Private, 12th, Never-married, Handlers-cleaners, Other-relative, White, Male,≤5000,≤40,<40, Mexico, <=50K
25-60, Self-emp-inc, HS-grad, Married-civ-spouse, Adm-clerical, Wife, White, Female,≤5000,≤40,<40, United-States, <=50K
25-60, Private, Some-college, Never-married, Other-service, Not-in-family, White, Female,≤5000,≤40,<40, United-States, <=50K
25-60, Private, HS-grad, Divorced, Transport-moving, Not-in-family, White, Male,≤5000,≤40,>60, United-States, <=50K
<25, Private, Some-college, Never-married, Transport-moving, Own-child, White, Male,≤5000,≤40,<40, United-States, <=50K
