age,workclass,education,marital-status,occupation,relationship,race,sex,capital-gain,capital-loss,hours-per-week,native-country,Probability
25-60, Private, HS-grad, Never-married, Handlers-cleaners, Not-in-family, Black, Male,≤5000,≤40,<40, United-States, <=50K
25-60, Private, HS-grad, Never-married, Handlers-cleaners, Not-in-family, Black, Male,≤5000,≤40,<40, United-States, <=50K
<25, Local-gov, Bachelors, Married-civ-spouse, Prof-specialty, Husband, White, Male,≤5000,≤40,<40, Germany, <=50K
<25, Private, HS-grad, Never-married, Handlers-cleaners, Not-in-family, Black, Male,≤5000,≤40,<40, United-States, <=50K
25-60, Self-emp-not-inc, 11th, Married-civ-spouse, Farming-fishing, Husband, White, Male,≤5000,≤40,>60, United-States, <=50K
<25, Private, Some-college, Never-married, Other-service, Own-child, White, Female,≤5000,≤40,<40, United-States, <=50K
