age,workclass,education,marital-status,occupation,relationship,race,sex,capital-gain,capital-loss,hours-per-week,native-country,Probability
25-60, Private, 9th, Divorced, Other-service, Unmarried, White, Female,≤5000,≤40,<40, United-States, <=50K
25-60, Private, Assoc-acdm, Married-civ-spouse, Exec-managerial, Wife, White, Female,≤5000,≤40,40-60, United-States, >50K
25-60, Private, 9th, Divorced, Adm-clerical, Unmarried, White, Female,≤5000,≤40,<40, United-States, <=50K
25-60, Private, HS-grad, Divorced, Other-service, Unmarried, White, Female,≤5000,≤40,<40, United-States, <=50K
25-60, Private, Masters, Divorced, Other-service, Unmarried, White, Female,≤5000,≤40,<40, United-States, <=50K
25-60, Private, 10th, Never-married, Other-service, Unmarried, White, Female,≤5000,≤40,<40, United-States, <=50K
