age,workclass,education,marital-status,occupation,relationship,race,sex,capital-gain,capital-loss,hours-per-week,native-country,Probability
25-60, Private, Some-college, Separated, Adm-clerical, Other-relative, Amer-Indian-Eskimo, Female,≤5000,≤40,40-60, United-States, <=50K
25-60, Private, HS-grad, Married-civ-spouse, Handlers-cleaners, Husband, White, Male,≤5000,≤40,<40, United-States, <=50K
25-60, Private, HS-grad, Never-married, Handlers-cleaners, Own-child, White, Male,≤5000,≤40,<40, United-States, <=50K
<25, Federal-gov, 11th, Never-married, Adm-clerical, Unmarried, Black, Female,≤5000,≤40,<40, United-States, <=50K
25-60, Private, HS-grad, Married-civ-spouse, Machine-op-inspct, Husband, White, Male,≤5000,≤40,40-60, Mexico, <=50K
25-60, Private, Some-college, Married-civ-spouse, Handlers-cleaners, Husband, White, Male,≤5000,≤40,<40, United-States, <=50K
