age,workclass,education,marital-status,occupation,relationship,race,sex,capital-gain,capital-loss,hours-per-week,native-country,Probability
25-60, Self-emp-not-inc, HS-grad, Married-civ-spouse, Farming-fishing, Husband, White, Male,≤5000,>40,<40, United-States, <=50K
25-60, Private, HS-grad, Divorced, Machine-op-inspct, Not-in-family, White, Female,≤5000,≤40,40-60, United-States, <=50K
<25, Local-gov, Some-college, Never-married, Handlers-cleaners, Not-in-family, White, Male,≤5000,≤40,<40, United-States, <=50K
25-60, State-gov, Some-college, Married-civ-spouse, Protective-serv, Husband, White, Male,≤5000,≤40,40-60, United-States, >50K
25-60, Self-emp-not-inc, HS-grad, Married-civ-spouse, Farming-fishing, Husband, White, Male,≤5000,≤40,40-60, United-States, <=50K
25-60, Self-emp-not-inc, HS-grad, Married-civ-spouse, Farming-fishing, Husband, White, Male,≤5000,≤40,40-60, United-States, <=50K
