age,workclass,education,marital-status,occupation,relationship,race,sex,capital-gain,capital-loss,hours-per-week,native-country,Probability
25-60, Private, Assoc-acdm, Never-married, Sales, Unmarried, Black, Male,≤5000,≤40,<40, United-States, <=50K
25-60, Private, Assoc-acdm, Never-married, Sales, Unmarried, Black, Female,≤5000,≤40,<40, United-States, <=50K
25-60, Private, Bachelors, Never-married, Sales, Unmarried, Black, Male,≤5000,≤40,40-60, United-States, <=50K
25-60, Private, Assoc-acdm, Divorced, Adm-clerical, Unmarried, Black, Female,≤5000,≤40,<40, United-States, <=50K
25-60, Private, Assoc-acdm, Never-married, Other-service, Unmarried, Black, Female,≤5000,≤40,<40, United-States, <=50K
25-60, Private, 9th, Never-married, Sales, Unmarried, Black, Female,≤5000,≤40,<40, United-States, <=50K
