age,workclass,education,marital-status,occupation,relationship,race,sex,capital-gain,capital-loss,hours-per-week,native-country,Probability
25-60, Private, 11th, Separated, Other-service, Unmarried, Black, Male,≤5000,≤40,<40, United-States, <=50K
25-60, Private, Some-college, Married-civ-spouse, Machine-op-inspct, Husband, White, Male,≤5000,≤40,<40, United-States, <=50K
25-60, Private, Some-college, Married-civ-spouse, Craft-repair, Husband, White, Male,≤5000,≤40,40-60, United-States, <=50K
<25, Private, Some-college, Never-married, Tech-support, Own-child, White, Male,≤5000,≤40,<40, United-States, <=50K
25-60, Private, 10th, Widowed, Other-service, Not-in-family, White, Female,≤5000,≤40,<40, Portugal, <=50K
25-60, Private, 11th, Separated, Other-service, Own-child, Black, Female,≤5000,≤40,<40, United-States, <=50K
