age,workclass,education,marital-status,occupation,relationship,race,sex,capital-gain,capital-loss,hours-per-week,native-country,Probability
25-60, Private, 7th-8th, Separated, Machine-op-inspct, Not-in-family, White, Male,≤5000,≤40,<40, United-States, <=50K
25-60, Private, 10th, Divorced, Machine-op-inspct, Not-in-family, White, Male,≤5000,≤40,<40, United-States, <=50K
25-60, Private, 5th-6th, Divorced, Machine-op-inspct, Unmarried, White, Female,≤5000,≤40,<40, Mexico, <=50K
25-60, Private, 10th, Divorced, Machine-op-inspct, Not-in-family, White, Male,≤5000,≤40,<40, United-States, <=50K
25-60, Private, Some-college, Divorced, Machine-op-inspct, Not-in-family, White, Male,≤5000,≤40,<40, United-States, <=50K
25-60, Private, 7th-8th, Separated, Other-service, Not-in-family, White, Female,≤5000,≤40,<40, United-States, <=50K
