age,workclass,education,marital-status,occupation,relationship,race,sex,capital-gain,capital-loss,hours-per-week,native-country,Probability
25-60, Private, 5th-6th, Separated, Other-service, Other-relative, White, Female,≤5000,≤40,<40, El-Salvador, <=50K
25-60, Private, HS-grad, Never-married, Craft-repair, Not-in-family, White, Male,≤5000,≤40,40-60, United-States, <=50K
<25, Private, HS-grad, Never-married, Other-service, Other-relative, White, Male,≤5000,≤40,<40, United-States, <=50K
>60, Self-emp-not-inc, HS-grad, Married-civ-spouse, Craft-repair, Husband, White, Male,≤5000,≤40,<40, Germany, <=50K
25-60, Private, HS-grad, Never-married, Transport-moving, Own-child, White, Male,≤5000,≤40,40-60, Portugal, <=50K
25-60, Private, Some-college, Divorced, Other-service, Not-in-family, White, Female,≤5000,≤40,<40, United-States, <=50K
