age,workclass,education,marital-status,occupation,relationship,race,sex,capital-gain,capital-loss,hours-per-week,native-country,Probability
25-60, Local-gov, 7th-8th, Divorced, Other-service, Unmarried, White, Female,≤5000,≤40,<40, Columbia, <=50K
25-60, Local-gov, Some-college, Divorced, Other-service, Unmarried, White, Female,≤5000,≤40,<40, United-States, <=50K
25-60, Private, 7th-8th, Divorced, Other-service, Unmarried, White, Female,≤5000,≤40,<40, United-States, <=50K
25-60, Local-gov, Some-college, Widowed, Other-service, Unmarried, White, Female,≤5000,≤40,<40, United-States, <=50K
25-60, Local-gov, Some-college, Divorced, Adm-clerical, Unmarried, White, Female,≤5000,≤40,<40, United-States, <=50K
25-60, Local-gov, Some-college, Divorced, Adm-clerical, Unmarried, White, Female,≤5000,≤40,<40, United-States, <=50K
