age,workclass,education,marital-status,occupation,relationship,race,sex,capital-gain,capital-loss,hours-per-week,native-country,Probability
25-60, Private, Some-college, Never-married, Other-service, Own-child, White, Male,≤5000,≤40,<40, United-States, <=50K
25-60, Local-gov, Bachelors, Divorced, Exec-managerial, Not-in-family, Black, Male,≤5000,≤40,<40, United-States, <=50K
25-60, Private, HS-grad, Married-civ-spouse, Craft-repair, Husband, White, Male,≤5000,≤40,<40, United-States, <=50K
25-60, Private, HS-grad, Married-civ-spouse, Adm-clerical, Wife, Black, Female,≤5000,≤40,<40, United-States, <=50K
25-60, Self-emp-not-inc, HS-grad, Never-married, Other-service, Own-child, White, Female,≤5000,≤40,<40, United-States, <=50K
<25, Private, Bachelors, Never-married, Exec-managerial, Not-in-family, White, Male,≤5000,≤40,40-60, United-States, <=50K
