age,workclass,education,marital-status,occupation,relationship,race,sex,capital-gain,capital-loss,hours-per-week,native-country,Probability
<25, State-gov, HS-grad, Never-married, Other-service, Own-child, Asian-Pac-Islander, Female,≤5000,≤40,<40, United-States, <=50K
25-60, Private, HS-grad, Divorced, Transport-moving, Not-in-family, White, Male,≤5000,≤40,40-60, United-States, <=50K
>60, Private, Bachelors, Married-civ-spouse, Protective-serv, Husband, White, Male,≤5000,>40,40-60, United-States, >50K
<25, Local-gov, HS-grad, Never-married, Other-service, Own-child, Asian-Pac-Islander, Male,≤5000,≤40,<40, United-States, <=50K
<25, State-gov, HS-grad, Never-married, Adm-clerical, Own-child, White, Female,≤5000,≤40,<40, United-States, <=50K
25-60, Private, HS-grad, Married-civ-spouse, Craft-repair, Husband, White, Male,≤5000,≤40,<40, United-States, <=50K
