age,workclass,education,marital-status,occupation,relationship,race,sex,capital-gain,capital-loss,hours-per-week,native-country,Probability
25-60, Private, Masters, Married-civ-spouse, Other-service, Husband, Asian-Pac-Islander, Male,≤5000,≤40,<40, China, <=50K
25-60, Private, Masters, Married-civ-spouse, Prof-specialty, Husband, Asian-Pac-Islander, Male,≤5000,≤40,<40, China, >50K
25-60, Private, HS-grad, Married-civ-spouse, Transport-moving, Husband, White, Male,≤5000,≤40,40-60, United-States, <=50K
25-60, Private, HS-grad, Married-civ-spouse, Other-service, Husband, Asian-Pac-Islander, Male,≤5000,≤40,<40, China, <=50K
25-60, Private, Bachelors, Divorced, Tech-support, Not-in-family, White, Female,≤5000,≤40,40-60, United-States, <=50K
25-60, Private, 1st-4th, Married-civ-spouse, Other-service, Husband, Asian-Pac-Islander, Male,≤5000,≤40,40-60, China, <=50K
