age,workclass,education,marital-status,occupation,relationship,race,sex,capital-gain,capital-loss,hours-per-week,native-country,Probability
25-60, Private, HS-grad, Never-married, Priv-house-serv, Not-in-family, White, Female,≤5000,≤40,<40, El-Salvador, <=50K
25-60, Self-emp-not-inc, Bachelors, Divorced, Exec-managerial, Not-in-family, White, Male,≤5000,≤40,40-60, United-States, <=50K
25-60, Private, Doctorate, Married-civ-spouse, Exec-managerial, Husband, White, Male,≤5000,≤40,<40, United-States, >50K
25-60, Self-emp-inc, Bachelors, Married-civ-spouse, Craft-repair, Husband, White, Male,≤5000,≤40,<40, United-States, >50K
<25, Private, Some-college, Never-married, Adm-clerical, Own-child, White, Female,≤5000,≤40,<40, United-States, <=50K
25-60, Private, HS-grad, Married-civ-spouse, Transport-moving, Husband, White, Male,≤5000,≤40,<40, United-States, <=50K
