age,workclass,education,marital-status,occupation,relationship,race,sex,capital-gain,capital-loss,hours-per-week,native-country,Probability
25-60, Private, Masters, Never-married, Exec-managerial, Not-in-family, White, Male,≤5000,≤40,40-60, United-States, <=50K
25-60, Private, Masters, Never-married, Exec-managerial, Not-in-family, White, Male,≤5000,≤40,40-60, United-States, <=50K
25-60, Local-gov, Some-college, Never-married, Adm-clerical, Not-in-family, White, Female,≤5000,≤40,<40, United-States, <=50K
25-60, Private, Some-college, Married-civ-spouse, Sales, Husband, White, Male,≤5000,≤40,40-60, United-States, >50K
25-60, Private, Some-college, Married-civ-spouse, Tech-support, Husband, White, Male,≤5000,≤40,<40, United-States, <=50K
25-60, State-gov, HS-grad, Married-civ-spouse, Protective-serv, Husband, White, Male,≤5000,≤40,40-60, United-States, <=50K
