age,workclass,education,marital-status,occupation,relationship,race,sex,capital-gain,capital-loss,hours-per-week,native-country,Probability
25-60, Private, 5th-6th, Married-spouse-absent, Priv-house-serv, Other-relative, White, Female,≤5000,≤40,<40, El-Salvador, <=50K
25-60, Private, Bachelors, Never-married, Sales, Not-in-family, White, Male,≤5000,≤40,<40, Ireland, <=50K
25-60, Private, 5th-6th, Separated, Other-service, Other-relative, White, Female,≤5000,≤40,<40, El-Salvador, <=50K
25-60, Private, HS-grad, Never-married, Other-service, Not-in-family, White, Male,≤5000,≤40,40-60, United-States, <=50K
25-60, Private, Assoc-voc, Married-civ-spouse, Craft-repair, Husband, White, Male,≤5000,≤40,<40, United-States, <=50K
25-60, Private, HS-grad, Never-married, Priv-house-serv, Not-in-family, White, Female,≤5000,≤40,<40, El-Salvador, <=50K
