age,workclass,education,marital-status,occupation,relationship,race,sex,capital-gain,capital-loss,hours-per-week,native-country,Probability
25-60, Private, HS-grad, Divorced, Other-service, Unmarried, Asian-Pac-Islander, Male,>5000,≤40,<40, Philippines, <=50K
25-60, Private, HS-grad, Widowed, Other-service, Unmarried, Asian-Pac-Islander, Female,≤5000,≤40,<40, Philippines, <=50K
25-60, Private, HS-grad, Divorced, Other-service, Not-in-family, White, Female,≤5000,≤40,<40, United-States, <=50K
25-60, Private, Assoc-acdm, Married-civ-spouse, Craft-repair, Husband, Black, Male,≤5000,≤40,<40, United-States, <=50K
25-60, Private, HS-grad, Married-civ-spouse, Tech-support, Husband, Asian-Pac-Islander, Male,≤5000,≤40,<40, Philippines, <=50K
25-60, Private, HS-grad, Married-civ-spouse, Other-service, Husband, Asian-Pac-Islander, Male,≤5000,≤40,<40, China, <=50K
