age,workclass,education,marital-status,occupation,relationship,race,sex,capital-gain,capital-loss,hours-per-week,native-country,Probability
25-60, Private, HS-grad, Married-civ-spouse, Farming-fishing, Husband, White, Male,≤5000,≤40,<40, Canada, <=50K
<25, Private, HS-grad, Never-married, Transport-moving, Not-in-family, White, Male,≤5000,≤40,<40, United-States, <=50K
25-60, Private, HS-grad, Never-married, Machine-op-inspct, Unmarried, Black, Female,≤5000,≤40,<40, United-States, <=50K
25-60, Private, HS-grad, Married-civ-spouse, Farming-fishing, Husband, White, Male,≤5000,≤40,<40, United-States, <=50K
25-60, Private, HS-grad, Married-civ-spouse, Farming-fishing, Husband, White, Male,≤5000,≤40,<40, United-States, <=50K
25-60, Self-emp-not-inc, Assoc-voc, Separated, Sales, Not-in-family, White, Male,≤5000,≤40,<40, Mexico, <=50K
