age,workclass,education,marital-status,occupation,relationship,race,sex,capital-gain,capital-loss,hours-per-week,native-country,Probability
25-60, Local-gov, Assoc-voc, Married-civ-spouse, Farming-fishing, Husband, White, Male,≤5000,≤40,<40, United-States, <=50K
<25, Private, Some-college, Married-civ-spouse, Sales, Wife, White, Female,≤5000,≤40,<40, United-States, <=50K
25-60, Private, Some-college, Married-civ-spouse, Adm-clerical, Husband, White, Male,≤5000,≤40,40-60, United-States, <=50K
25-60, Private, Masters, Never-married, Sales, Not-in-family, White, Female,≤5000,≤40,<40, United-States, <=50K
25-60, Private, HS-grad, Married-civ-spouse, Handlers-cleaners, Husband, Asian-Pac-Islander, Male,≤5000,≤40,<40, United-States, <=50K
<25, Private, Some-college, Never-married, Sales, Own-child, White, Male,≤5000,≤40,<40, United-States, <=50K
