age,workclass,education,marital-status,occupation,relationship,race,sex,capital-gain,capital-loss,hours-per-week,native-country,Probability
25-60, Private, HS-grad, Never-married, Adm-clerical, Not-in-family, Asian-Pac-Islander, Female,≤5000,≤40,<40, Trinadad&Tobago, <=50K
25-60, Private, Bachelors, Never-married, Handlers-cleaners, Not-in-family, White, Male,≤5000,≤40,<40, United-States, <=50K
25-60, Private, HS-grad, Never-married, Adm-clerical, Not-in-family, White, Female,≤5000,≤40,<40, United-States, <=50K
>60, Private, 10th, Widowed, Tech-support, Not-in-family, White, Female,≤5000,≤40,<40, United-States, <=50K
<25, Private, Some-college, Never-married, Other-service, Not-in-family, White, Female,≤5000,≤40,40-60, United-States, <=50K
25-60, Private, HS-grad, Divorced, Adm-clerical, Not-in-family, White, Female,≤5000,≤40,<40, United-States, <=50K
