age,workclass,education,marital-status,occupation,relationship,race,sex,capital-gain,capital-loss,hours-per-week,native-country,Probability
25-60, Private, HS-grad, Married-civ-spouse, Other-service, Wife, Black, Female,≤5000,≤40,<40, United-States, <=50K
25-60, Private, Bachelors, Divorced, Sales, Not-in-family, White, Female,≤5000,≤40,<40, United-States, <=50K
25-60, Federal-gov, Bachelors, Married-civ-spouse, Exec-managerial, Wife, Other, Female,≤5000,≤40,<40, United-States, >50K
25-60, Private, Some-college, Married-civ-spouse, Prof-specialty, Wife, White, Female,≤5000,≤40,<40, United-States, >50K
25-60, Private, HS-grad, Married-civ-spouse, Other-service, Husband, Black, Male,≤5000,≤40,<40, United-States, <=50K
25-60, Private, HS-grad, Married-civ-spouse, Other-service, Wife, White, Female,≤5000,≤40,<40, United-States, <=50K
