age,workclass,education,marital-status,occupation,relationship,race,sex,capital-gain,capital-loss,hours-per-week,native-country,Probability
25-60, Private, Assoc-acdm, Never-married, Prof-specialty, Not-in-family, White, Male,≤5000,≤40,<40, United-States, <=50K
25-60, Private, Bachelors, Married-civ-spouse, Sales, Husband, White, Male,>5000,≤40,40-60, United-States, >50K
25-60, Private, Assoc-voc, Never-married, Adm-clerical, Unmarried, Black, Female,≤5000,≤40,<40, United-States, <=50K
25-60, Self-emp-inc, Bachelors, Married-civ-spouse, Tech-support, Husband, White, Male,>5000,≤40,>60, United-States, >50K
25-60, Private, 11th, Married-civ-spouse, Farming-fishing, Husband, White, Male,≤5000,≤40,<40, United-States, <=50K
25-60, State-gov, Assoc-voc, Married-civ-spouse, Prof-specialty, Wife, Asian-Pac-Islander, Female,≤5000,≤40,<40, Philippines, >50K
