age,workclass,education,marital-status,occupation,relationship,race,sex,capital-gain,capital-loss,hours-per-week,native-country,Probability
<25, Private, HS-grad, Never-married, Farming-fishing, Own-child, White, Male,≤5000,≤40,<40, United-States, <=50K
>60, Private, 7th-8th, Married-civ-spouse, Other-service, Husband, White, Male,≤5000,≤40,<40, United-States, <=50K
25-60, Self-emp-not-inc, Masters, Divorced, Prof-specialty, Not-in-family, White, Female,≤5000,≤40,<40, United-States, <=50K
<25, Private, HS-grad, Never-married, Farming-fishing, Own-child, White, Male,≤5000,≤40,<40, United-States, <=50K
25-60, Private, HS-grad, Never-married, Transport-moving, Own-child, White, Male,≤5000,≤40,<40, United-States, <=50K
<25, Private, 10th, Never-married, Farming-fishing, Own-child, White, Male,≤5000,≤40,<40, United-States, <=50K
