age,workclass,education,marital-status,occupation,relationship,race,sex,capital-gain,capital-loss,hours-per-week,native-country,Probability
<25, Private, HS-grad, Divorced, Handlers-cleaners, Unmarried, White, Male,≤5000,≤40,<40, United-States, <=50K
25-60, Private, Bachelors, Married-civ-spouse, Craft-repair, Husband, White, Male,≤5000,≤40,40-60, United-States, >50K
25-60, Private, Bachelors, Married-civ-spouse, Exec-managerial, Husband, White, Male,≤5000,≤40,40-60, United-States, >50K
25-60, Private, HS-grad, Married-civ-spouse, Sales, Husband, White, Male,≤5000,≤40,<40, United-States, <=50K
25-60, Federal-gov, Bachelors, Never-married, Tech-support, Own-child, Black, Male,≤5000,≤40,<40, United-States, <=50K
<25, Private, Some-college, Never-married, Tech-support, Not-in-family, White, Female,≤5000,≤40,<40, United-States, <=50K
