age,workclass,education,marital-status,occupation,relationship,race,sex,capital-gain,capital-loss,hours-per-week,native-country,Probability
25-60, Private, Bachelors, Separated, Exec-managerial, Not-in-family, White, Male,≤5000,≤40,40-60, United-States, <=50K
<25, Private, Some-college, Married-civ-spouse, Craft-repair, Husband, White, Male,≤5000,≤40,40-60, United-States, <=50K
25-60, Local-gov, HS-grad, Widowed, Prof-specialty, Unmarried, Amer-Indian-Eskimo, Female,≤5000,≤40,<40, United-States, <=50K
25-60, Private, HS-grad, Never-married, Other-service, Unmarried, White, Male,≤5000,≤40,<40, Portugal, <=50K
<25, Private, 11th, Never-married, Sales, Own-child, White, Female,≤5000,≤40,<40, United-States, <=50K
25-60, Private, Bachelors, Married-civ-spouse, Prof-specialty, Husband, White, Male,≤5000,≤40,<40, United-States, >50K
