age,workclass,education,marital-status,occupation,relationship,race,sex,capital-gain,capital-loss,hours-per-week,native-country,Probability
25-60, Private, 10th, Never-married, Farming-fishing, Unmarried, Black, Female,≤5000,≤40,<40, United-States, <=50K
25-60, Private, HS-grad, Divorced, Craft-repair, Not-in-family, White, Male,≤5000,≤40,<40, United-States, <=50K
25-60, Private, HS-grad, Divorced, Sales, Not-in-family, White, Female,≤5000,≤40,<40, United-States, <=50K
25-60, Private, Bachelors, Married-civ-spouse, Exec-managerial, Husband, White, Male,>5000,≤40,<40, United-States, >50K
25-60, Private, Assoc-voc, Never-married, Adm-clerical, Unmarried, Black, Female,≤5000,≤40,<40, United-States, <=50K
<25, Private, Assoc-voc, Never-married, Sales, Own-child, White, Female,≤5000,≤40,<40, United-States, <=50K
