age,workclass,education,marital-status,occupation,relationship,race,sex,capital-gain,capital-loss,hours-per-week,native-country,Probability
<25, Private, 11th, Never-married, Farming-fishing, Not-in-family, White, Male,≤5000,≤40,<40, United-States, <=50K
<25, Private, 7th-8th, Never-married, Farming-fishing, Not-in-family, White, Male,≤5000,≤40,<40, United-States, <=50K
25-60, Federal-gov, Assoc-voc, Never-married, Prof-specialty, Not-in-family, White, Female,≤5000,≤40,<40, United-States, <=50K
25-60, Private, HS-grad, Divorced, Craft-repair, Not-in-family, White, Female,≤5000,≤40,<40, United-States, <=50K
<25, Private, HS-grad, Never-married, Farming-fishing, Not-in-family, White, Male,≤5000,≤40,<40, United-States, <=50K
<25, Private, HS-grad, Never-married, Sales, Unmarried, White, Female,≤5000,≤40,<40, United-States, <=50K
