age,workclass,education,marital-status,occupation,relationship,race,sex,capital-gain,capital-loss,hours-per-week,native-country,Probability
25-60, Self-emp-inc, HS-grad, Divorced, Other-service, Unmarried, White, Male,≤5000,≤40,<40, United-States, <=50K
25-60, Self-emp-inc, HS-grad, Divorced, Other-service, Unmarried, White, Female,≤5000,≤40,<40, United-States, <=50K
25-60, Federal-gov, HS-grad, Divorced, Other-service, Unmarried, White, Male,≤5000,≤40,<40, United-States, <=50K
25-60, Federal-gov, HS-grad, Never-married, Other-service, Unmarried, White, Male,≤5000,≤40,<40, United-States, <=50K
25-60, Self-emp-inc, HS-grad, Divorced, Exec-managerial, Unmarried, White, Male,≤5000,≤40,<40, United-States, <=50K
25-60, Private, HS-grad, Divorced, Other-service, Unmarried, White, Male,≤5000,≤40,<40, United-States, <=50K
