age,workclass,education,marital-status,occupation,relationship,race,sex,capital-gain,capital-loss,hours-per-week,native-country,Probability
25-60, Private, 11th, Married-civ-spouse, Transport-moving, Husband, White, Male,≤5000,≤40,<40, United-States, <=50K
25-60, Private, 9th, Married-civ-spouse, Craft-repair, Husband, White, Male,≤5000,≤40,<40, Mexico, <=50K
>60, Self-emp-not-inc, Masters, Divorced, Sales, Not-in-family, Other, Male,≤5000,≤40,<40, United-States, <=50K
25-60, Private, HS-grad, Married-civ-spouse, Handlers-cleaners, Husband, Asian-Pac-Islander, Male,≤5000,>40,<40, Vietnam, <=50K
25-60, Private, 11th, Married-civ-spouse, Transport-moving, Husband, White, Male,≤5000,≤40,<40, United-States, <=50K
<25, Private, HS-grad, Never-married, Craft-repair, Other-relative, White, Male,≤5000,≤40,40-60, United-States, <=50K
