age,workclass,education,marital-status,occupation,relationship,race,sex,capital-gain,capital-loss,hours-per-week,native-country,Probability
<25, Private, HS-grad, Never-married, Priv-house-serv, Not-in-family, White, Female,≤5000,≤40,<40, United-States, <=50K
25-60, Self-emp-not-inc, 5th-6th, Married-civ-spouse, Farming-fishing, Husband, White, Male,≤5000,≤40,<40, Mexico, <=50K
25-60, Private, Masters, Divorced, Other-service, Not-in-family, White, Female,≤5000,≤40,40-60, United-States, <=50K
25-60, Private, Bachelors, Married-civ-spouse, Protective-serv, Husband, Black, Male,≤5000,≤40,<40, United-States, >50K
<25, Private, HS-grad, Never-married, Craft-repair, Own-child, White, Male,≤5000,≤40,<40, United-States, <=50K
25-60, Private, Some-college, Divorced, Priv-house-serv, Not-in-family, White, Female,≤5000,≤40,<40, United-States, <=50K
