age,workclass,education,marital-status,occupation,relationship,race,sex,capital-gain,capital-loss,hours-per-week,native-country,Probability
25-60, Private, Masters, Divorced, Sales, Unmarried, Other, Female,≤5000,≤40,<40, Peru, <=50K
25-60, Private, 10th, Divorced, Sales, Unmarried, White, Female,≤5000,≤40,<40, United-States, <=50K
25-60, Private, Masters, Divorced, Prof-specialty, Unmarried, Other, Male,≤5000,≤40,<40, Mexico, <=50K
25-60, Local-gov, Prof-school, Married-civ-spouse, Prof-specialty, Husband, White, Male,≤5000,>40,<40, United-States, >50K
25-60, Private, HS-grad, Divorced, Sales, Unmarried, White, Female,≤5000,≤40,<40, United-States, <=50K
25-60, Private, Masters, Never-married, Prof-specialty, Unmarried, Amer-Indian-Eskimo, Female,≤5000,≤40,<40, United-States, <=50K
