age,workclass,education,marital-status,occupation,relationship,race,sex,capital-gain,capital-loss,hours-per-week,native-country,Probability
25-60, Local-gov, 7th-8th, Married-civ-spouse, Machine-op-inspct, Husband, White, Male,≤5000,≤40,<40, United-States, <=50K
>60, Private, 10th, Widowed, Priv-house-serv, Not-in-family, White, Female,≤5000,≤40,40-60, United-States, <=50K
>60, Self-emp-inc, Bachelors, Divorced, Sales, Not-in-family, White, Female,≤5000,≤40,<40, United-States, <=50K
25-60, Local-gov, Masters, Married-civ-spouse, Adm-clerical, Husband, White, Male,≤5000,≤40,<40, United-States, >50K
25-60, Local-gov, Some-college, Married-civ-spouse, Adm-clerical, Husband, White, Male,≤5000,≤40,<40, United-States, <=50K
25-60, Private, Masters, Divorced, Exec-managerial, Not-in-family, White, Female,≤5000,≤40,40-60, United-States, <=50K
