age,workclass,education,marital-status,occupation,relationship,race,sex,capital-gain,capital-loss,hours-per-week,native-country,Probability
<25, Private, 11th, Never-married, Machine-op-inspct, Own-child, White, Male,≤5000,≤40,<40, United-States, <=50K
25-60, Private, HS-grad, Married-civ-spouse, Craft-repair, Husband, White, Male,≤5000,≤40,40-60, United-States, <=50K
25-60, Self-emp-inc, HS-grad, Married-civ-spouse, Farming-fishing, Husband, White, Male,≤5000,≤40,>60, United-States, <=50K
<25, Private, 11th, Never-married, Handlers-cleaners, Own-child, White, Male,≤5000,≤40,<40, United-States, <=50K
<25, Private, 11th, Never-married, Sales, Own-child, White, Male,≤5000,≤40,<40, United-States, <=50K
<25, Private, 11th, Never-married, Other-service, Own-child, White, Male,≤5000,≤40,<40, United-States, <=50K
