age,workclass,education,marital-status,occupation,relationship,race,sex,capital-gain,capital-loss,hours-per-week,native-country,Probability
<25, State-gov, Some-college, Married-civ-spouse, Craft-repair, Own-child, White, Male,≤5000,≤40,40-60, United-States, <=50K
25-60, Private, HS-grad, Never-married, Other-service, Own-child, White, Male,≤5000,≤40,<40, United-States, <=50K
<25, Private, Some-college, Married-civ-spouse, Craft-repair, Husband, White, Male,≤5000,≤40,40-60, United-States, <=50K
25-60, Private, Some-college, Married-civ-spouse, Sales, Husband, White, Male,≤5000,≤40,40-60, United-States, >50K
25-60, Private, Masters, Married-civ-spouse, Prof-specialty, Husband, White, Male,≤5000,≤40,<40, United-States, >50K
>60, Private, Some-college, Widowed, Other-service, Unmarried, Black, Female,≤5000,≤40,<40, United-States, <=50K
