age,workclass,education,marital-status,occupation,relationship,race,sex,capital-gain,capital-loss,hours-per-week,native-country,Probability
>60, Private, Bachelors, Divorced, Sales, Not-in-family, Asian-Pac-Islander, Female,≤5000,≤40,<40, South, <=50K
25-60, Private, Bachelors, Never-married, Handlers-cleaners, Not-in-family, White, Male,≤5000,≤40,<40, United-States, <=50K
25-60, Private, Bachelors, Divorced, Adm-clerical, Not-in-family, Asian-Pac-Islander, Female,≤5000,≤40,<40, Philippines, <=50K
>60, Private, Bachelors, Divorced, Adm-clerical, Not-in-family, White, Female,≤5000,≤40,<40, United-States, <=50K
25-60, Private, Bachelors, Divorced, Prof-specialty, Not-in-family, Asian-Pac-Islander, Female,≤5000,≤40,<40, Philippines, <=50K
25-60, Self-emp-not-inc, Bachelors, Divorced, Sales, Unmarried, Asian-Pac-Islander, Female,≤5000,≤40,<40, South, <=50K
