age,workclass,education,marital-status,occupation,relationship,race,sex,capital-gain,capital-loss,hours-per-week,native-country,Probability
<25, Private, HS-grad, Married-civ-spouse, Craft-repair, Other-relative, White, Male,≤5000,≤40,<40, Ecuador, <=50K
<25, Private, HS-grad, Married-civ-spouse, Craft-repair, Other-relative, White, Male,≤5000,≤40,<40, United-States, <=50K
25-60, Self-emp-not-inc, Masters, Married-civ-spouse, Exec-managerial, Wife, White, Female,≤5000,≤40,<40, United-States, >50K
<25, Local-gov, HS-grad, Never-married, Protective-serv, Own-child, White, Female,≤5000,≤40,<40, United-States, <=50K
25-60, Local-gov, HS-grad, Married-civ-spouse, Handlers-cleaners, Husband, Asian-Pac-Islander, Male,≤5000,≤40,>60, Philippines, <=50K
25-60, Private, Bachelors, Married-civ-spouse, Adm-clerical, Husband, White, Male,≤5000,≤40,40-60, United-States, >50K
