age,workclass,education,marital-status,occupation,relationship,race,sex,capital-gain,capital-loss,hours-per-week,native-country,Probability
25-60, Local-gov, Doctorate, Divorced, Prof-specialty, Not-in-family, White, Female,≤5000,≤40,40-60, United-States, <=50K
25-60, Local-gov, Bachelors, Divorced, Prof-specialty, Not-in-family, White, Female,≤5000,≤40,40-60, United-States, <=50K
25-60, Local-gov, Assoc-voc, Divorced, Prof-specialty, Not-in-family, White, Female,≤5000,≤40,<40, United-States, <=50K
25-60, Private, HS-grad, Married-civ-spouse, Sales, Husband, White, Male,≤5000,≤40,<40, United-States, <=50K
25-60, Private, Masters, Divorced, Other-service, Not-in-family, Black, Female,≤5000,≤40,<40, United-States, <=50K
25-60, Private, Some-college, Married-civ-spouse, Transport-moving, Husband, White, Male,≤5000,≤40,40-60, United-States, <=50K
