age,workclass,education,marital-status,occupation,relationship,race,sex,capital-gain,capital-loss,hours-per-week,native-country,Probability
25-60, Self-emp-not-inc, HS-grad, Divorced, Tech-support, Not-in-family, White, Male,≤5000,≤40,40-60, United-States, <=50K
<25, Private, 11th, Never-married, Other-service, Own-child, White, Male,≤5000,≤40,<40, United-States, <=50K
25-60, Private, Bachelors, Married-spouse-absent, Prof-specialty, Not-in-family, Asian-Pac-Islander, Male,≤5000,≤40,<40, Japan, <=50K
25-60, Self-emp-not-inc, HS-grad, Divorced, Exec-managerial, Not-in-family, White, Male,≤5000,≤40,40-60, United-States, <=50K
25-60, Federal-gov, HS-grad, Divorced, Adm-clerical, Not-in-family, White, Male,≤5000,≤40,<40, United-States, <=50K
25-60, Self-emp-not-inc, HS-grad, Divorced, Sales, Not-in-family, White, Male,≤5000,≤40,<40, United-States, <=50K
