age,workclass,education,marital-status,occupation,relationship,race,sex,capital-gain,capital-loss,hours-per-week,native-country,Probability
25-60, Self-emp-not-inc, Assoc-acdm, Married-civ-spouse, Sales, Husband, Asian-Pac-Islander, Male,≤5000,≤40,>60, South, <=50K
<25, Self-emp-inc, Bachelors, Never-married, Handlers-cleaners, Own-child, White, Male,≤5000,≤40,<40, United-States, <=50K
25-60, Self-emp-inc, HS-grad, Married-civ-spouse, Sales, Husband, Asian-Pac-Islander, Male,≤5000,≤40,40-60, South, <=50K
25-60, Self-emp-not-inc, Masters, Divorced, Sales, Not-in-family, Asian-Pac-Islander, Male,≤5000,≤40,40-60, South, <=50K
25-60, Self-emp-not-inc, HS-grad, Married-civ-spouse, Craft-repair, Husband, Asian-Pac-Islander, Male,≤5000,≤40,40-60, South, <=50K
25-60, Self-emp-inc, Bachelors, Married-civ-spouse, Sales, Husband, Asian-Pac-Islander, Male,≤5000,≤40,40-60, South, >50K
