age,workclass,education,marital-status,occupation,relationship,race,sex,capital-gain,capital-loss,hours-per-week,native-country,Probability
25-60, Private, Masters, Never-married, Prof-specialty, Not-in-family, Black, Female,≤5000,≤40,<40, United-States, <=50K
25-60, Federal-gov, Masters, Married-civ-spouse, Prof-specialty, Husband, White, Male,≤5000,≤40,<40, United-States, >50K
25-60, State-gov, Masters, Never-married, Prof-specialty, Unmarried, White, Male,≤5000,≤40,<40, United-States, <=50K
<25, Private, HS-grad, Never-married, Other-service, Not-in-family, Black, Female,≤5000,≤40,40-60, United-States, <=50K
25-60, Private, Assoc-acdm, Married-civ-spouse, Sales, Husband, White, Male,≤5000,≤40,<40, United-States, <=50K
25-60, Private, HS-grad, Divorced, Machine-op-inspct, Not-in-family, White, Female,≤5000,≤40,<40, United-States, <=50K
