age,workclass,education,marital-status,occupation,relationship,race,sex,capital-gain,capital-loss,hours-per-week,native-country,Probability
25-60, Private, HS-grad, Married-spouse-absent, Machine-op-inspct, Not-in-family, White, Male,≤5000,>40,40-60, United-States, <=50K
25-60, Private, HS-grad, Married-civ-spouse, Adm-clerical, Husband, White, Male,≤5000,≤40,<40, United-States, <=50K
25-60, Private, HS-grad, Divorced, Machine-op-inspct, Not-in-family, White, Male,≤5000,≤40,40-60, United-States, <=50K
25-60, Private, HS-grad, Never-married, Machine-op-inspct, Not-in-family, White, Male,≤5000,≤40,40-60, United-States, <=50K
25-60, Private, HS-grad, Married-civ-spouse, Machine-op-inspct, Husband, White, Male,≤5000,>40,40-60, United-States, >50K
25-60, Private, HS-grad, Separated, Machine-op-inspct, Not-in-family, White, Male,≤5000,≤40,40-60, United-States, <=50K
