age,workclass,education,marital-status,occupation,relationship,race,sex,capital-gain,capital-loss,hours-per-week,native-country,Probability
>60, Private, HS-grad, Never-married, Sales, Own-child, White, Female,≤5000,≤40,<40, United-States, <=50K
25-60, Private, Some-college, Divorced, Other-service, Not-in-family, Black, Female,≤5000,≤40,<40, United-States, <=50K
25-60, Private, HS-grad, Never-married, Sales, Own-child, White, Female,≤5000,≤40,<40, United-States, <=50K
25-60, State-gov, Masters, Married-civ-spouse, Exec-managerial, Husband, White, Male,≤5000,≤40,40-60, United-States, >50K
25-60, Federal-gov, Bachelors, Separated, Tech-support, Unmarried, White, Male,≤5000,≤40,<40, United-States, <=50K
25-60, Private, 7th-8th, Married-civ-spouse, Machine-op-inspct, Husband, Amer-Indian-Eskimo, Male,≤5000,≤40,<40, United-States, <=50K
