age,workclass,education,marital-status,occupation,relationship,race,sex,capital-gain,capital-loss,hours-per-week,native-country,Probability
25-60, Private, 5th-6th, Separated, Machine-op-inspct, Unmarried, White, Female,≤5000,≤40,<40, Dominican-Republic, <=50K
25-60, Private, 10th, Divorced, Machine-op-inspct, Unmarried, White, Female,≤5000,≤40,<40, United-States, <=50K
25-60, Private, 5th-6th, Separated, Machine-op-inspct, Other-relative, White, Female,≤5000,≤40,<40, Ecuador, <=50K
25-60, Private, HS-grad, Separated, Machine-op-inspct, Unmarried, White, Female,≤5000,≤40,<40, United-States, <=50K
25-60, Self-emp-not-inc, Bachelors, Married-civ-spouse, Farming-fishing, Husband, White, Male,≤5000,≤40,>60, United-States, <=50K
25-60, Private, HS-grad, Separated, Machine-op-inspct, Unmarried, White, Female,≤5000,≤40,<40, United-States, <=50K
