age,workclass,education,marital-status,occupation,relationship,race,sex,capital-gain,capital-loss,hours-per-week,native-country,Probability
25-60, Self-emp-not-inc, Bachelors, Married-civ-spouse, Sales, Husband, White, Male,≤5000,≤40,<40, United-States, <=50K
25-60, Self-emp-not-inc, Bachelors, Married-civ-spouse, Sales, Husband, White, Male,≤5000,≤40,<40, United-States, <=50K
25-60, Private, Bachelors, Never-married, Exec-managerial, Not-in-family, White, Female,≤5000,≤40,<40, United-States, <=50K
25-60, Self-emp-not-inc, HS-grad, Divorced, Exec-managerial, Unmarried, White, Female,≤5000,≤40,>60, United-States, <=50K
25-60, Self-emp-not-inc, Bachelors, Married-civ-spouse, Sales, Husband, White, Male,≤5000,≤40,<40, United-States, <=50K
>60, Private, 12th, Never-married, Craft-repair, Unmarried, White, Male,≤5000,≤40,<40, United-States, <=50K
