age,workclass,education,marital-status,occupation,relationship,race,sex,capital-gain,capital-loss,hours-per-week,native-country,Probability
25-60, Local-gov, HS-grad, Separated, Protective-serv, Not-in-family, White, Male,≤5000,>40,<40, United-States, <=50K
25-60, Local-gov, HS-grad, Divorced, Protective-serv, Not-in-family, White, Female,≤5000,≤40,<40, United-States, <=50K
25-60, Private, HS-grad, Married-civ-spouse, Craft-repair, Husband, White, Male,≤5000,≤40,>60, United-States, <=50K
25-60, Private, HS-grad, Widowed, Other-service, Unmarried, Asian-Pac-Islander, Female,≤5000,≤40,<40, Philippines, <=50K
25-60, Local-gov, HS-grad, Never-married, Protective-serv, Not-in-family, White, Male,≤5000,≤40,<40, United-States, <=50K
25-60, Local-gov, HS-grad, Separated, Other-service, Not-in-family, White, Male,≤5000,≤40,<40, United-States, <=50K
