age,workclass,education,marital-status,occupation,relationship,race,sex,capital-gain,capital-loss,hours-per-week,native-country,Probability
25-60, Private, 11th, Married-civ-spouse, Protective-serv, Husband, White, Male,≤5000,≤40,<40, United-States, <=50K
<25, Private, Some-college, Never-married, Sales, Not-in-family, White, Male,≤5000,≤40,<40, United-States, <=50K
25-60, Private, HS-grad, Divorced, Craft-repair, Not-in-family, White, Male,≤5000,≤40,40-60, United-States, <=50K
<25, Private, HS-grad, Never-married, Other-service, Other-relative, White, Male,≤5000,≤40,<40, United-States, <=50K
25-60, Private, 11th, Married-civ-spouse, Transport-moving, Husband, White, Male,≤5000,≤40,<40, United-States, <=50K
25-60, Private, 11th, Married-civ-spouse, Craft-repair, Husband, White, Male,≤5000,≤40,<40, United-States, <=50K
