age,workclass,education,marital-status,occupation,relationship,race,sex,capital-gain,capital-loss,hours-per-week,native-country,Probability
25-60, Private, Bachelors, Divorced, Adm-clerical, Not-in-family, Asian-Pac-Islander, Female,≤5000,≤40,<40, Philippines, <=50K
25-60, Private, Some-college, Divorced, Other-service, Unmarried, White, Female,≤5000,≤40,<40, United-States, <=50K
<25, Private, Some-college, Never-married, Other-service, Not-in-family, White, Female,≤5000,≤40,40-60, United-States, <=50K
25-60, Private, Preschool, Married-civ-spouse, Other-service, Husband, White, Male,≤5000,≤40,<40, Mexico, <=50K
25-60, State-gov, Some-college, Never-married, Tech-support, Not-in-family, White, Female,≤5000,≤40,40-60, United-States, <=50K
25-60, Private, HS-grad, Divorced, Other-service, Not-in-family, White, Female,≤5000,≤40,<40, United-States, <=50K
