age,workclass,education,marital-status,occupation,relationship,race,sex,capital-gain,capital-loss,hours-per-week,native-country,Probability
<25, Private, Bachelors, Never-married, Sales, Not-in-family, White, Female,≤5000,≤40,40-60, United-States, <=50K
25-60, Private, HS-grad, Married-civ-spouse, Exec-managerial, Husband, White, Male,≤5000,≤40,40-60, Mexico, <=50K
25-60, Self-emp-not-inc, Some-college, Married-civ-spouse, Exec-managerial, Husband, White, Male,≤5000,≤40,40-60, United-States, >50K
25-60, Local-gov, Some-college, Married-civ-spouse, Prof-specialty, Husband, Other, Male,≤5000,≤40,<40, United-States, <=50K
25-60, Self-emp-not-inc, HS-grad, Divorced, Craft-repair, Unmarried, White, Male,≤5000,≤40,40-60, United-States, <=50K
25-60, State-gov, Bachelors, Married-civ-spouse, Craft-repair, Husband, White, Male,≤5000,≤40,<40, United-States, <=50K
