age,workclass,education,marital-status,occupation,relationship,race,sex,capital-gain,capital-loss,hours-per-week,native-country,Probability
25-60, Private, Assoc-acdm, Married-civ-spouse, Sales, Husband, White, Male,≤5000,≤40,<40, United-States, <=50K
25-60, Private, Some-college, Married-civ-spouse, Exec-managerial, Husband, White, Male,≤5000,≤40,>60, United-States, >50K
<25, Private, 10th, Never-married, Craft-repair, Own-child, White, Male,≤5000,≤40,<40, United-States, <=50K
25-60, Private, 7th-8th, Never-married, Machine-op-inspct, Not-in-family, White, Male,≤5000,≤40,40-60, United-States, <=50K
25-60, Self-emp-inc, HS-grad, Married-civ-spouse, Sales, Husband, White, Male,≤5000,≤40,>60, United-States, >50K
25-60, Local-gov, Some-college, Married-civ-spouse, Protective-serv, Husband, White, Male,≤5000,≤40,<40, United-States, <=50K
