age,workclass,education,marital-status,occupation,relationship,race,sex,capital-gain,capital-loss,hours-per-week,native-country,Probability
25-60, Self-emp-inc, Some-college, Never-married, Exec-managerial, Not-in-family, White, Female,≤5000,≤40,<40, United-States, <=50K
<25, Private, HS-grad, Never-married, Sales, Other-relative, Black, Female,≤5000,≤40,<40, United-States, <=50K
<25, Private, HS-grad, Never-married, Sales, Other-relative, White, Female,≤5000,≤40,<40, United-States, <=50K
25-60, Private, 10th, Separated, Machine-op-inspct, Own-child, White, Male,≤5000,≤40,<40, United-States, <=50K
25-60, Private, 10th, Divorced, Tech-support, Unmarried, Black, Female,≤5000,≤40,<40, United-States, <=50K
25-60, Private, HS-grad, Never-married, Sales, Not-in-family, White, Male,≤5000,≤40,<40, United-States, <=50K
