age,workclass,education,marital-status,occupation,relationship,race,sex,capital-gain,capital-loss,hours-per-week,native-country,Probability
25-60, Self-emp-not-inc, Some-college, Married-civ-spouse, Other-service, Wife, White, Female,≤5000,≤40,<40, United-States, <=50K
25-60, Private, Bachelors, Divorced, Prof-specialty, Not-in-family, White, Female,≤5000,≤40,<40, United-States, <=50K
25-60, Private, 1st-4th, Married-spouse-absent, Farming-fishing, Not-in-family, White, Male,≤5000,≤40,<40, Mexico, <=50K
25-60, Private, HS-grad, Divorced, Exec-managerial, Not-in-family, White, Male,≤5000,≤40,40-60, United-States, <=50K
25-60, Self-emp-not-inc, HS-grad, Married-civ-spouse, Other-service, Wife, White, Female,≤5000,≤40,<40, United-States, <=50K
25-60, Self-emp-not-inc, HS-grad, Married-civ-spouse, Other-service, Wife, White, Female,≤5000,≤40,<40, United-States, <=50K
