age,workclass,education,marital-status,occupation,relationship,race,sex,capital-gain,capital-loss,hours-per-week,native-country,Probability
25-60, Private, HS-grad, Divorced, Handlers-cleaners, Unmarried, White, Male,≤5000,≤40,<40, United-States, <=50K
25-60, Private, HS-grad, Divorced, Handlers-cleaners, Unmarried, White, Male,≤5000,≤40,<40, United-States, <=50K
25-60, Private, HS-grad, Married-civ-spouse, Sales, Husband, White, Male,≤5000,≤40,<40, United-States, <=50K
25-60, Private, HS-grad, Married-civ-spouse, Sales, Husband, White, Male,>5000,≤40,40-60, United-States, >50K
25-60, Private, HS-grad, Separated, Handlers-cleaners, Unmarried, White, Male,≤5000,≤40,<40, United-States, <=50K
25-60, Private, HS-grad, Never-married, Handlers-cleaners, Unmarried, White, Male,≤5000,≤40,<40, United-States, <=50K
