age,workclass,education,marital-status,occupation,relationship,race,sex,capital-gain,capital-loss,hours-per-week,native-country,Probability
25-60, Private, HS-grad, Separated, Handlers-cleaners, Own-child, White, Female,≤5000,>40,<40, United-States, <=50K
25-60, Local-gov, Bachelors, Divorced, Craft-repair, Not-in-family, White, Male,≤5000,≤40,<40, United-States, <=50K
25-60, Private, HS-grad, Never-married, Handlers-cleaners, Own-child, White, Female,≤5000,≤40,<40, United-States, <=50K
25-60, Private, HS-grad, Never-married, Sales, Unmarried, White, Female,≤5000,≤40,<40, United-States, <=50K
25-60, Private, 9th, Married-civ-spouse, Other-service, Wife, Asian-Pac-Islander, Female,≤5000,≤40,<40, Hong, <=50K
25-60, Private, HS-grad, Divorced, Adm-clerical, Own-child, White, Female,≤5000,≤40,<40, United-States, <=50K
