age,workclass,education,marital-status,occupation,relationship,race,sex,capital-gain,capital-loss,hours-per-week,native-country,Probability
25-60, Private, Preschool, Never-married, Other-service, Unmarried, White, Male,≤5000,≤40,<40, El-Salvador, <=50K
25-60, Private, Bachelors, Married-civ-spouse, Sales, Husband, White, Male,≤5000,≤40,40-60, United-States, >50K
25-60, Self-emp-not-inc, Assoc-acdm, Married-civ-spouse, Tech-support, Husband, White, Male,≤5000,≤40,40-60, United-States, >50K
25-60, Private, Bachelors, Married-civ-spouse, Prof-specialty, Husband, White, Male,>5000,≤40,<40, United-States, >50K
25-60, Private, Bachelors, Married-civ-spouse, Sales, Husband, White, Male,≤5000,≤40,40-60, United-States, >50K
25-60, Private, 10th, Never-married, Other-service, Unmarried, White, Female,≤5000,≤40,<40, United-States, <=50K
