age,workclass,education,marital-status,occupation,relationship,race,sex,capital-gain,capital-loss,hours-per-week,native-country,Probability
25-60, Private, Masters, Divorced, Prof-specialty, Not-in-family, White, Female,≤5000,≤40,40-60, United-States, <=50K
25-60, Self-emp-not-inc, HS-grad, Married-civ-spouse, Transport-moving, Husband, Black, Male,≤5000,≤40,<40, Haiti, <=50K
25-60, Private, Bachelors, Married-civ-spouse, Prof-specialty, Husband, White, Male,≤5000,≤40,40-60, United-States, >50K
>60, Self-emp-not-inc, Bachelors, Married-civ-spouse, Prof-specialty, Husband, White, Male,≤5000,≤40,<40, United-States, <=50K
25-60, Private, Some-college, Married-civ-spouse, Craft-repair, Husband, White, Male,≤5000,≤40,>60, United-States, <=50K
25-60, Federal-gov, Some-college, Married-civ-spouse, Adm-clerical, Husband, White, Male,≤5000,>40,<40, United-States, >50K
