age,workclass,education,marital-status,occupation,relationship,race,sex,capital-gain,capital-loss,hours-per-week,native-country,Probability
25-60, Private, 11th, Never-married, Other-service, Other-relative, Asian-Pac-Islander, Male,≤5000,≤40,<40, United-States, <=50K
25-60, Private, Doctorate, Married-spouse-absent, Prof-specialty, Not-in-family, Asian-Pac-Islander, Male,>5000,≤40,40-60, China, >50K
25-60, Private, Some-college, Divorced, Adm-clerical, Unmarried, White, Female,≤5000,≤40,<40, United-States, <=50K
25-60, Private, 11th, Never-married, Handlers-cleaners, Other-relative, White, Male,≤5000,≤40,<40, United-States, <=50K
25-60, Private, Bachelors, Separated, Sales, Not-in-family, White, Male,≤5000,≤40,40-60, United-States, <=50K
25-60, Private, HS-grad, Never-married, Other-service, Not-in-family, White, Male,≤5000,≤40,<40, United-States, <=50K
