age,workclass,education,marital-status,occupation,relationship,race,sex,capital-gain,capital-loss,hours-per-week,native-country,Probability
25-60, Local-gov, Assoc-voc, Separated, Craft-repair, Unmarried, Black, Male,≤5000,≤40,<40, United-States, <=50K
25-60, Local-gov, HS-grad, Separated, Adm-clerical, Unmarried, Black, Female,≤5000,≤40,<40, United-States, <=50K
25-60, Private, Assoc-voc, Separated, Adm-clerical, Unmarried, Black, Female,≤5000,≤40,<40, United-States, <=50K
25-60, Local-gov, Assoc-acdm, Separated, Adm-clerical, Unmarried, Black, Female,≤5000,≤40,<40, United-States, <=50K
25-60, Local-gov, HS-grad, Separated, Adm-clerical, Unmarried, Black, Female,≤5000,≤40,<40, United-States, <=50K
25-60, Federal-gov, 10th, Separated, Adm-clerical, Unmarried, Black, Female,≤5000,≤40,<40, United-States, <=50K
