age,workclass,education,marital-status,occupation,relationship,race,sex,capital-gain,capital-loss,hours-per-week,native-country,Probability
>60, Private, Bachelors, Widowed, Exec-managerial, Other-relative, White, Female,≤5000,≤40,<40, United-States, <=50K
25-60, Private, Bachelors, Widowed, Exec-managerial, Unmarried, White, Female,≤5000,≤40,<40, United-States, <=50K
<25, Private, 11th, Never-married, Sales, Own-child, White, Female,≤5000,≤40,<40, United-States, <=50K
>60, Private, 10th, Widowed, Adm-clerical, Other-relative, White, Male,≤5000,≤40,<40, United-States, <=50K
>60, Private, Bachelors, Divorced, Farming-fishing, Other-relative, White, Female,≤5000,≤40,<40, United-States, <=50K
>60, Private, Bachelors, Divorced, Exec-managerial, Not-in-family, White, Female,≤5000,≤40,<40, United-States, <=50K
