age,workclass,education,marital-status,occupation,relationship,race,sex,capital-gain,capital-loss,hours-per-week,native-country,Probability
>60, Local-gov, HS-grad, Married-civ-spouse, Sales, Husband, White, Male,≤5000,≤40,<40, United-States, <=50K
25-60, Private, Assoc-voc, Married-civ-spouse, Machine-op-inspct, Husband, White, Male,≤5000,≤40,<40, United-States, <=50K
>60, Local-gov, HS-grad, Married-civ-spouse, Adm-clerical, Husband, White, Male,≤5000,≤40,<40, United-States, <=50K
25-60, Self-emp-inc, Bachelors, Married-civ-spouse, Exec-managerial, Husband, White, Male,≤5000,≤40,40-60, United-States, >50K
25-60, Private, HS-grad, Divorced, Craft-repair, Not-in-family, White, Male,≤5000,≤40,<40, United-States, <=50K
25-60, Local-gov, HS-grad, Married-civ-spouse, Adm-clerical, Husband, White, Male,≤5000,≤40,<40, United-States, <=50K
