age,workclass,education,marital-status,occupation,relationship,race,sex,capital-gain,capital-loss,hours-per-week,native-country,Probability
25-60, Private, Some-college, Married-spouse-absent, Craft-repair, Other-relative, White, Male,≤5000,≤40,<40, Mexico, <=50K
25-60, Private, Some-college, Divorced, Craft-repair, Not-in-family, White, Male,≤5000,≤40,40-60, Mexico, <=50K
25-60, Private, 10th, Married-civ-spouse, Craft-repair, Husband, White, Male,≤5000,≤40,<40, Mexico, <=50K
25-60, Private, Some-college, Never-married, Craft-repair, Unmarried, White, Male,≤5000,≤40,<40, Mexico, <=50K
25-60, Private, HS-grad, Married-spouse-absent, Farming-fishing, Other-relative, White, Male,≤5000,≤40,<40, Mexico, <=50K
25-60, Private, HS-grad, Married-spouse-absent, Craft-repair, Other-relative, White, Male,≤5000,≤40,<40, Poland, <=50K
