age,workclass,education,marital-status,occupation,relationship,race,sex,capital-gain,capital-loss,hours-per-week,native-country,Probability
25-60, Self-emp-not-inc, Bachelors, Never-married, Farming-fishing, Not-in-family, White, Female,≤5000,≤40,<40, United-States, <=50K
25-60, Federal-gov, Assoc-voc, Never-married, Adm-clerical, Not-in-family, Other, Male,≤5000,≤40,40-60, United-States, <=50K
25-60, Private, Assoc-voc, Married-civ-spouse, Craft-repair, Husband, White, Male,≤5000,≤40,<40, United-States, <=50K
25-60, Self-emp-not-inc, Bachelors, Divorced, Other-service, Not-in-family, White, Female,≤5000,≤40,<40, United-States, <=50K
25-60, Self-emp-not-inc, Bachelors, Never-married, Prof-specialty, Not-in-family, White, Male,≤5000,≤40,<40, United-States, <=50K
25-60, Private, Bachelors, Never-married, Adm-clerical, Not-in-family, White, Female,≤5000,≤40,<40, United-States, <=50K
