age,workclass,education,marital-status,occupation,relationship,race,sex,capital-gain,capital-loss,hours-per-week,native-country,Probability
>60, Private, HS-grad, Widowed, Adm-clerical, Unmarried, White, Female,≤5000,≤40,<40, United-States, <=50K
>60, Private, HS-grad, Widowed, Other-service, Unmarried, White, Female,≤5000,≤40,<40, United-States, <=50K
25-60, Private, HS-grad, Widowed, Adm-clerical, Unmarried, White, Female,≤5000,≤40,<40, United-States, <=50K
>60, Private, HS-grad, Widowed, Craft-repair, Unmarried, White, Female,≤5000,≤40,<40, United-States, <=50K
25-60, Private, Some-college, Never-married, Adm-clerical, Not-in-family, White, Female,≤5000,≤40,<40, United-States, <=50K
25-60, State-gov, Masters, Married-civ-spouse, Prof-specialty, Wife, White, Female,≤5000,≤40,<40, United-States, >50K
