age,workclass,education,marital-status,occupation,relationship,race,sex,capital-gain,capital-loss,hours-per-week,native-country,Probability
25-60, Private, Some-college, Never-married, Exec-managerial, Not-in-family, Black, Female,≤5000,≤40,<40, United-States, <=50K
25-60, State-gov, Some-college, Married-civ-spouse, Tech-support, Husband, White, Male,>5000,≤40,<40, United-States, >50K
<25, Private, HS-grad, Never-married, Sales, Other-relative, White, Female,≤5000,≤40,<40, United-States, <=50K
25-60, Private, HS-grad, Never-married, Sales, Not-in-family, White, Male,≤5000,≤40,<40, United-States, <=50K
25-60, Private, Some-college, Never-married, Machine-op-inspct, Not-in-family, Black, Female,≤5000,≤40,<40, United-States, <=50K
25-60, State-gov, HS-grad, Married-civ-spouse, Craft-repair, Husband, White, Male,≤5000,≤40,<40, United-States, <=50K
