age,workclass,education,marital-status,occupation,relationship,race,sex,capital-gain,capital-loss,hours-per-week,native-country,Probability
<25, Private, Bachelors, Married-civ-spouse, Prof-specialty, Husband, White, Male,≤5000,≤40,<40, United-States, <=50K
25-60, Private, Bachelors, Never-married, Exec-managerial, Not-in-family, White, Female,≤5000,≤40,<40, United-States, <=50K
25-60, Private, HS-grad, Married-civ-spouse, Adm-clerical, Wife, White, Female,≤5000,≤40,<40, United-States, <=50K
25-60, Local-gov, 9th, Married-civ-spouse, Other-service, Wife, White, Female,≤5000,≤40,<40, Puerto-Rico, <=50K
25-60, Private, Some-college, Married-civ-spouse, Adm-clerical, Husband, White, Male,≤5000,≤40,<40, United-States, <=50K
25-60, Private, Bachelors, Never-married, Craft-repair, Not-in-family, White, Male,≤5000,≤40,<40, United-States, <=50K
