age,workclass,education,marital-status,occupation,relationship,race,sex,capital-gain,capital-loss,hours-per-week,native-country,Probability
25-60, Private, HS-grad, Divorced, Adm-clerical, Unmarried, Black, Female,≤5000,≤40,<40, United-States, <=50K
25-60, Private, HS-grad, Divorced, Adm-clerical, Unmarried, Black, Female,≤5000,≤40,<40, United-States, <=50K
25-60, Local-gov, HS-grad, Separated, Adm-clerical, Unmarried, White, Female,≤5000,≤40,<40, Puerto-Rico, <=50K
25-60, Private, HS-grad, Divorced, Adm-clerical, Unmarried, Black, Female,≤5000,≤40,<40, United-States, <=50K
25-60, Private, HS-grad, Divorced, Handlers-cleaners, Unmarried, Black, Female,≤5000,≤40,<40, United-States, <=50K
25-60, Private, HS-grad, Widowed, Adm-clerical, Unmarried, Black, Female,≤5000,≤40,<40, United-States, <=50K
