age,workclass,education,marital-status,occupation,relationship,race,sex,capital-gain,capital-loss,hours-per-week,native-country,Probability
25-60, State-gov, HS-grad, Never-married, Adm-clerical, Not-in-family, Black, Female,≤5000,≤40,<40, United-States, <=50K
25-60, State-gov, HS-grad, Never-married, Prof-specialty, Not-in-family, Black, Female,≤5000,≤40,<40, United-States, <=50K
25-60, State-gov, HS-grad, Never-married, Other-service, Not-in-family, Black, Female,≤5000,≤40,<40, United-States, <=50K
25-60, State-gov, Bachelors, Never-married, Adm-clerical, Not-in-family, Black, Female,≤5000,≤40,<40, United-States, <=50K
25-60, Federal-gov, HS-grad, Divorced, Adm-clerical, Not-in-family, Black, Female,≤5000,≤40,<40, United-States, <=50K
25-60, State-gov, HS-grad, Never-married, Adm-clerical, Own-child, Black, Female,≤5000,≤40,<40, United-States, <=50K
