age,workclass,education,marital-status,occupation,relationship,race,sex,capital-gain,capital-loss,hours-per-week,native-country,Probability
<25, Private, Assoc-voc, Never-married, Craft-repair, Not-in-family, Other, Male,≤5000,≤40,<40, United-States, <=50K
25-60, Private, Assoc-voc, Married-civ-spouse, Tech-support, Husband, White, Male,≤5000,≤40,<40, United-States, <=50K
25-60, Local-gov, HS-grad, Married-civ-spouse, Transport-moving, Husband, Black, Male,≤5000,≤40,<40, United-States, <=50K
<25, Private, Some-college, Never-married, Craft-repair, Not-in-family, White, Male,≤5000,≤40,<40, United-States, <=50K
<25, Private, Assoc-voc, Never-married, Exec-managerial, Not-in-family, White, Male,≤5000,≤40,<40, United-States, <=50K
25-60, Self-emp-not-inc, HS-grad, Married-civ-spouse, Farming-fishing, Husband, White, Male,≤5000,≤40,40-60, United-States, <=50K
