age,workclass,education,marital-status,occupation,relationship,race,sex,capital-gain,capital-loss,hours-per-week,native-country,Probability
25-60, Private, Some-college, Divorced, Prof-specialty, Not-in-family, Black, Female,≤5000,≤40,<40, United-States, <=50K
25-60, Private, Some-college, Divorced, Machine-op-inspct, Not-in-family, Black, Female,≤5000,≤40,<40, United-States, <=50K
25-60, State-gov, HS-grad, Married-civ-spouse, Protective-serv, Husband, White, Male,≤5000,≤40,40-60, United-States, <=50K
25-60, Self-emp-not-inc, HS-grad, Married-civ-spouse, Farming-fishing, Husband, White, Male,≤5000,≤40,<40, Mexico, <=50K
25-60, Private, Some-college, Divorced, Adm-clerical, Not-in-family, Black, Male,≤5000,≤40,<40, United-States, <=50K
25-60, Private, Some-college, Separated, Prof-specialty, Not-in-family, Black, Male,≤5000,≤40,<40, United-States, <=50K
