age,workclass,education,marital-status,occupation,relationship,race,sex,capital-gain,capital-loss,hours-per-week,native-country,Probability
25-60, Private, 11th, Divorced, Transport-moving, Own-child, Black, Male,≤5000,≤40,40-60, United-States, <=50K
25-60, Private, Assoc-voc, Married-civ-spouse, Machine-op-inspct, Husband, White, Male,≤5000,≤40,<40, United-States, <=50K
<25, Private, Bachelors, Never-married, Prof-specialty, Not-in-family, White, Female,≤5000,≤40,<40, United-States, <=50K
25-60, Private, HS-grad, Married-civ-spouse, Transport-moving, Husband, Black, Male,≤5000,≤40,40-60, United-States, <=50K
25-60, Private, 10th, Divorced, Transport-moving, Own-child, White, Male,≤5000,≤40,<40, United-States, <=50K
25-60, Private, 11th, Married-civ-spouse, Transport-moving, Husband, White, Male,≤5000,≤40,40-60, United-States, <=50K
