age,workclass,education,marital-status,occupation,relationship,race,sex,capital-gain,capital-loss,hours-per-week,native-country,Probability
<25, Private, Some-college, Never-married, Machine-op-inspct, Not-in-family, White, Female,≤5000,≤40,>60, United-States, <=50K
25-60, Self-emp-not-inc, HS-grad, Married-civ-spouse, Farming-fishing, Husband, White, Male,≤5000,≤40,>60, United-States, <=50K
>60, Local-gov, 1st-4th, Widowed, Farming-fishing, Not-in-family, Asian-Pac-Islander, Male,≤5000,≤40,<40, Philippines, <=50K
<25, Private, Some-college, Never-married, Machine-op-inspct, Not-in-family, White, Female,≤5000,≤40,<40, United-States, <=50K
<25, Private, HS-grad, Never-married, Other-service, Not-in-family, White, Female,≤5000,≤40,<40, United-States, <=50K
<25, Private, Some-college, Never-married, Adm-clerical, Not-in-family, White, Male,≤5000,≤40,40-60, United-States, <=50K
