age,workclass,education,marital-status,occupation,relationship,race,sex,capital-gain,capital-loss,hours-per-week,native-country,Probability
25-60, Self-emp-not-inc, HS-grad, Married-civ-spouse, Craft-repair, Husband, White, Male,≤5000,≤40,<40, United-States, <=50K
25-60, Self-emp-not-inc, HS-grad, Divorced, Craft-repair, Own-child, White, Male,≤5000,≤40,<40, United-States, <=50K
<25, Private, HS-grad, Never-married, Other-service, Own-child, White, Male,≤5000,≤40,<40, United-States, <=50K
25-60, Self-emp-not-inc, Preschool, Divorced, Other-service, Unmarried, White, Female,≤5000,≤40,<40, Mexico, <=50K
25-60, Self-emp-not-inc, HS-grad, Married-civ-spouse, Craft-repair, Husband, White, Male,≤5000,≤40,<40, United-States, <=50K
25-60, Self-emp-not-inc, Bachelors, Married-civ-spouse, Exec-managerial, Husband, White, Male,≤5000,≤40,<40, United-States, >50K
