age,workclass,education,marital-status,occupation,relationship,race,sex,capital-gain,capital-loss,hours-per-week,native-country,Probability
<25, Self-emp-inc, 9th, Never-married, Craft-repair, Unmarried, White, Male,≤5000,>40,<40, United-States, <=50K
<25, Self-emp-inc, Some-college, Never-married, Craft-repair, Own-child, White, Male,≤5000,≤40,<40, United-States, <=50K
<25, Self-emp-not-inc, HS-grad, Never-married, Craft-repair, Unmarried, White, Male,≤5000,≤40,<40, United-States, <=50K
>60, Private, Some-college, Married-civ-spouse, Adm-clerical, Husband, White, Male,≤5000,≤40,<40, France, <=50K
<25, Private, HS-grad, Never-married, Craft-repair, Unmarried, White, Male,≤5000,≤40,<40, United-States, <=50K
<25, Private, HS-grad, Never-married, Craft-repair, Unmarried, White, Male,≤5000,≤40,<40, United-States, <=50K
