age,workclass,education,marital-status,occupation,relationship,race,sex,capital-gain,capital-loss,hours-per-week,native-country,Probability
<25, Private, Bachelors, Never-married, Machine-op-inspct, Not-in-family, White, Male,≤5000,≤40,>60, United-States, <=50K
25-60, Local-gov, HS-grad, Married-civ-spouse, Adm-clerical, Wife, White, Female,≤5000,≤40,<40, United-States, <=50K
25-60, Self-emp-not-inc, 9th, Married-civ-spouse, Craft-repair, Husband, White, Male,≤5000,≤40,<40, United-States, <=50K
<25, Private, 10th, Never-married, Machine-op-inspct, Not-in-family, White, Male,≤5000,≤40,<40, United-States, <=50K
<25, Private, Bachelors, Never-married, Exec-managerial, Not-in-family, White, Male,≤5000,≤40,40-60, United-States, <=50K
<25, Private, Bachelors, Never-married, Adm-clerical, Not-in-family, White, Female,≤5000,≤40,40-60, United-States, <=50K
