age,workclass,education,marital-status,occupation,relationship,race,sex,capital-gain,capital-loss,hours-per-week,native-country,Probability
<25, Private, HS-grad, Never-married, Transport-moving, Own-child, White, Female,≤5000,≤40,<40, United-States, <=50K
25-60, State-gov, Bachelors, Never-married, Exec-managerial, Unmarried, White, Female,≤5000,≤40,<40, United-States, <=50K
25-60, Private, HS-grad, Never-married, Adm-clerical, Not-in-family, White, Female,≤5000,≤40,<40, United-States, <=50K
25-60, Private, Masters, Never-married, Exec-managerial, Not-in-family, White, Female,≤5000,≤40,40-60, United-States, <=50K
25-60, Private, Bachelors, Never-married, Sales, Not-in-family, White, Female,≤5000,≤40,<40, United-States, <=50K
25-60, Self-emp-not-inc, Some-college, Married-civ-spouse, Prof-specialty, Husband, White, Male,≤5000,≤40,40-60, United-States, <=50K
