age,workclass,education,marital-status,occupation,relationship,race,sex,capital-gain,capital-loss,hours-per-week,native-country,Probability
25-60, Private, Assoc-acdm, Divorced, Sales, Not-in-family, White, Male,≤5000,≤40,<40, United-States, <=50K
25-60, Private, Assoc-acdm, Divorced, Sales, Not-in-family, White, Male,≤5000,≤40,<40, United-States, <=50K
25-60, Private, Some-college, Married-civ-spouse, Adm-clerical, Wife, White, Female,≤5000,≤40,<40, United-States, <=50K
25-60, Private, Assoc-acdm, Never-married, Sales, Not-in-family, White, Male,≤5000,≤40,<40, United-States, <=50K
25-60, Private, Assoc-acdm, Divorced, Sales, Not-in-family, White, Female,≤5000,≤40,<40, United-States, <=50K
25-60, Private, Bachelors, Divorced, Sales, Not-in-family, White, Male,≤5000,≤40,<40, United-States, <=50K
