age,workclass,education,marital-status,occupation,relationship,race,sex,capital-gain,capital-loss,hours-per-week,native-country,Probability
25-60, Self-emp-inc, Prof-school, Never-married, Prof-specialty, Not-in-family, White, Female,≤5000,≤40,40-60, United-States, <=50K
25-60, State-gov, Prof-school, Never-married, Prof-specialty, Not-in-family, White, Female,≤5000,≤40,40-60, United-States, <=50K
25-60, Private, HS-grad, Married-civ-spouse, Exec-managerial, Husband, White, Male,≤5000,≤40,<40, United-States, <=50K
25-60, Private, Bachelors, Divorced, Prof-specialty, Unmarried, Black, Female,≤5000,≤40,40-60, United-States, <=50K
25-60, Private, Prof-school, Never-married, Prof-specialty, Not-in-family, White, Male,≤5000,≤40,40-60, United-States, <=50K
25-60, Self-emp-not-inc, Prof-school, Never-married, Prof-specialty, Not-in-family, White, Male,≤5000,≤40,40-60, United-States, <=50K
