age,workclass,education,marital-status,occupation,relationship,race,sex,capital-gain,capital-loss,hours-per-week,native-country,Probability
25-60, Self-emp-not-inc, Assoc-voc, Married-civ-spouse, Farming-fishing, Husband, White, Male,≤5000,≤40,>60, United-States, <=50K
25-60, State-gov, Bachelors, Married-civ-spouse, Exec-managerial, Husband, White, Male,≤5000,≤40,40-60, United-States, >50K
<25, Private, HS-grad, Never-married, Machine-op-inspct, Other-relative, White, Female,≤5000,≤40,<40, Columbia, <=50K
25-60, Private, HS-grad, Married-civ-spouse, Sales, Husband, White, Male,≤5000,≤40,40-60, United-States, <=50K
<25, Private, HS-grad, Never-married, Handlers-cleaners, Own-child, White, Male,≤5000,≤40,<40, United-States, <=50K
25-60, Private, HS-grad, Married-spouse-absent, Other-service, Not-in-family, White, Female,≤5000,≤40,<40, El-Salvador, <=50K
