age,workclass,education,marital-status,occupation,relationship,race,sex,capital-gain,capital-loss,hours-per-week,native-country,Probability
>60, Self-emp-not-inc, Preschool, Widowed, Exec-managerial, Not-in-family, White, Female,≤5000,≤40,40-60, United-States, <=50K
25-60, Private, HS-grad, Married-civ-spouse, Machine-op-inspct, Husband, Black, Male,≤5000,≤40,<40, Haiti, <=50K
>60, Self-emp-not-inc, Assoc-voc, Divorced, Prof-specialty, Not-in-family, White, Female,>5000,≤40,40-60, United-States, >50K
25-60, Private, Some-college, Never-married, Sales, Not-in-family, Black, Female,≤5000,≤40,<40, United-States, <=50K
<25, Private, 10th, Never-married, Transport-moving, Own-child, White, Male,≤5000,≤40,<40, United-States, <=50K
>60, State-gov, HS-grad, Married-civ-spouse, Transport-moving, Husband, White, Male,≤5000,≤40,<40, United-States, <=50K
