age,workclass,education,marital-status,occupation,relationship,race,sex,capital-gain,capital-loss,hours-per-week,native-country,Probability
25-60, Private, HS-grad, Never-married, Machine-op-inspct, Own-child, Black, Male,≤5000,≤40,<40, United-States, <=50K
25-60, Local-gov, HS-grad, Separated, Other-service, Unmarried, White, Female,≤5000,≤40,<40, United-States, <=50K
25-60, Private, HS-grad, Married-civ-spouse, Craft-repair, Husband, White, Male,>5000,≤40,40-60, United-States, >50K
25-60, State-gov, Bachelors, Never-married, Adm-clerical, Not-in-family, Other, Female,≤5000,≤40,<40, United-States, <=50K
25-60, Private, Bachelors, Married-civ-spouse, Sales, Husband, White, Male,≤5000,≤40,40-60, United-States, >50K
>60, Self-emp-not-inc, Some-college, Married-civ-spouse, Tech-support, Husband, White, Male,≤5000,≤40,<40, Greece, <=50K
