age,workclass,education,marital-status,occupation,relationship,race,sex,capital-gain,capital-loss,hours-per-week,native-country,Probability
<25, Private, Some-college, Separated, Sales, Unmarried, Black, Female,≤5000,≤40,<40, United-States, <=50K
25-60, Self-emp-not-inc, HS-grad, Married-civ-spouse, Farming-fishing, Husband, White, Male,≤5000,≤40,40-60, United-States, <=50K
25-60, Private, Masters, Married-civ-spouse, Exec-managerial, Husband, White, Male,>5000,≤40,40-60, United-States, >50K
<25, Private, HS-grad, Never-married, Transport-moving, Own-child, White, Male,≤5000,≤40,40-60, United-States, <=50K
25-60, Private, 9th, Divorced, Other-service, Unmarried, Black, Female,≤5000,≤40,<40, Haiti, <=50K
<25, Private, 7th-8th, Married-civ-spouse, Machine-op-inspct, Husband, White, Male,≤5000,≤40,<40, United-States, <=50K
