age,workclass,education,marital-status,occupation,relationship,race,sex,capital-gain,capital-loss,hours-per-week,native-country,Probability
>60, Local-gov, Bachelors, Widowed, Adm-clerical, Unmarried, Asian-Pac-Islander, Female,≤5000,≤40,<40, Philippines, <=50K
>60, Local-gov, 5th-6th, Widowed, Other-service, Other-relative, Asian-Pac-Islander, Female,≤5000,≤40,<40, Philippines, <=50K
25-60, Private, Bachelors, Divorced, Other-service, Unmarried, Asian-Pac-Islander, Female,≤5000,≤40,<40, Philippines, <=50K
25-60, Private, Bachelors, Never-married, Adm-clerical, Unmarried, Asian-Pac-Islander, Female,≤5000,≤40,<40, Philippines, <=50K
>60, Local-gov, 1st-4th, Widowed, Farming-fishing, Not-in-family, Asian-Pac-Islander, Male,≤5000,≤40,<40, Philippines, <=50K
>60, Local-gov, HS-grad, Widowed, Adm-clerical, Unmarried, White, Female,≤5000,≤40,<40, United-States, <=50K
