age,workclass,education,marital-status,occupation,relationship,race,sex,capital-gain,capital-loss,hours-per-week,native-country,Probability
25-60, Private, 10th, Separated, Other-service, Unmarried, Black, Female,≤5000,≤40,<40, United-States, <=50K
25-60, Private, HS-grad, Separated, Other-service, Unmarried, Black, Female,≤5000,≤40,<40, United-States, <=50K
25-60, State-gov, Bachelors, Married-civ-spouse, Adm-clerical, Husband, Other, Male,≤5000,≤40,<40, United-States, <=50K
25-60, Private, Some-college, Separated, Other-service, Unmarried, Black, Female,≤5000,≤40,<40, United-States, <=50K
25-60, Private, Some-college, Married-civ-spouse, Other-service, Husband, White, Male,≤5000,≤40,<40, United-States, <=50K
25-60, Private, 11th, Separated, Other-service, Unmarried, Black, Male,≤5000,≤40,<40, United-States, <=50K
