age,workclass,education,marital-status,occupation,relationship,race,sex,capital-gain,capital-loss,hours-per-week,native-country,Probability
25-60, Private, HS-grad, Married-civ-spouse, Other-service, Other-relative, Black, Female,≤5000,≤40,<40, Jamaica, <=50K
25-60, Private, HS-grad, Married-civ-spouse, Other-service, Other-relative, Black, Female,≤5000,≤40,<40, United-States, <=50K
25-60, Private, HS-grad, Divorced, Other-service, Unmarried, Black, Female,≤5000,≤40,<40, Jamaica, <=50K
25-60, Private, HS-grad, Married-civ-spouse, Craft-repair, Husband, Black, Male,≤5000,≤40,<40, Jamaica, <=50K
25-60, Private, HS-grad, Never-married, Other-service, Other-relative, Black, Female,≤5000,≤40,<40, United-States, <=50K
25-60, Private, HS-grad, Married-civ-spouse, Other-service, Husband, Black, Male,≤5000,≤40,<40, United-States, <=50K
