age,workclass,education,marital-status,occupation,relationship,race,sex,capital-gain,capital-loss,hours-per-week,native-country,Probability
25-60, Private, 9th, Separated, Other-service, Not-in-family, Black, Male,≤5000,≤40,<40, United-States, <=50K
25-60, Private, Some-college, Married-civ-spouse, Exec-managerial, Husband, White, Male,≤5000,>40,<40, United-States, >50K
25-60, State-gov, Bachelors, Married-civ-spouse, Adm-clerical, Husband, Other, Male,≤5000,≤40,<40, United-States, <=50K
25-60, Private, HS-grad, Divorced, Other-service, Not-in-family, Black, Male,≤5000,≤40,<40, United-States, <=50K
25-60, Private, 11th, Separated, Other-service, Not-in-family, White, Male,≤5000,≤40,<40, United-States, <=50K
25-60, Private, Assoc-voc, Married-civ-spouse, Adm-clerical, Husband, White, Male,>5000,≤40,<40, United-States, >50K
