age,workclass,education,marital-status,occupation,relationship,race,sex,capital-gain,capital-loss,hours-per-week,native-country,Probability
25-60, Private, HS-grad, Never-married, Craft-repair, Own-child, White, Male,≤5000,≤40,<40, United-States, <=50K
<25, Private, Some-college, Married-civ-spouse, Adm-clerical, Husband, White, Male,≤5000,≤40,<40, United-States, <=50K
25-60, Private, HS-grad, Married-civ-spouse, Handlers-cleaners, Husband, White, Male,≤5000,≤40,<40, United-States, <=50K
25-60, Private, 11th, Never-married, Machine-op-inspct, Not-in-family, White, Male,≤5000,≤40,<40, United-States, <=50K
25-60, Private, HS-grad, Never-married, Craft-repair, Own-child, White, Male,≤5000,≤40,<40, United-States, <=50K
25-60, Private, HS-grad, Divorced, Machine-op-inspct, Unmarried, White, Female,≤5000,≤40,<40, United-States, <=50K
