age,workclass,education,marital-status,occupation,relationship,race,sex,capital-gain,capital-loss,hours-per-week,native-country,Probability
<25, Private, 12th, Never-married, Other-service, Not-in-family, White, Male,≤5000,≤40,40-60, United-States, <=50K
25-60, Local-gov, Masters, Never-married, Prof-specialty, Not-in-family, White, Male,≤5000,≤40,<40, United-States, <=50K
25-60, Private, HS-grad, Married-civ-spouse, Craft-repair, Husband, White, Male,≤5000,≤40,<40, United-States, <=50K
25-60, Private, Masters, Divorced, Prof-specialty, Not-in-family, White, Female,≤5000,≤40,<40, United-States, <=50K
>60, Private, HS-grad, Married-civ-spouse, Craft-repair, Husband, White, Male,≤5000,≤40,<40, United-States, <=50K
25-60, Private, Some-college, Never-married, Machine-op-inspct, Not-in-family, White, Female,≤5000,≤40,<40, United-States, <=50K
