age,workclass,education,marital-status,occupation,relationship,race,sex,capital-gain,capital-loss,hours-per-week,native-country,Probability
25-60, Private, 9th, Married-civ-spouse, Machine-op-inspct, Wife, Other, Female,≤5000,≤40,<40, Portugal, <=50K
25-60, Self-emp-not-inc, HS-grad, Divorced, Sales, Not-in-family, White, Male,≤5000,≤40,<40, United-States, <=50K
25-60, State-gov, Bachelors, Married-civ-spouse, Prof-specialty, Husband, White, Male,≤5000,≤40,<40, United-States, >50K
25-60, Private, 9th, Married-civ-spouse, Craft-repair, Husband, Other, Male,≤5000,≤40,<40, Mexico, <=50K
25-60, Federal-gov, HS-grad, Married-civ-spouse, Adm-clerical, Wife, White, Female,≤5000,≤40,<40, United-States, <=50K
25-60, Private, HS-grad, Married-civ-spouse, Machine-op-inspct, Wife, White, Female,≤5000,≤40,<40, United-States, <=50K
