age,workclass,education,marital-status,occupation,relationship,race,sex,capital-gain,capital-loss,hours-per-week,native-country,Probability
25-60, Private, Some-college, Separated, Transport-moving, Unmarried, White, Male,≤5000,≤40,40-60, United-States, <=50K
25-60, Local-gov, Bachelors, Never-married, Prof-specialty, Own-child, White, Female,≤5000,≤40,<40, United-States, <=50K
25-60, Private, Some-college, Separated, Transport-moving, Not-in-family, White, Male,≤5000,≤40,<40, United-States, <=50K
25-60, Private, Some-college, Divorced, Sales, Unmarried, White, Male,≤5000,≤40,40-60, United-States, <=50K
25-60, Private, Some-college, Married-civ-spouse, Transport-moving, Husband, White, Male,≤5000,≤40,40-60, United-States, <=50K
25-60, Private, Some-college, Separated, Prof-specialty, Unmarried, White, Female,≤5000,≤40,40-60, United-States, <=50K
