age,workclass,education,marital-status,occupation,relationship,race,sex,capital-gain,capital-loss,hours-per-week,native-country,Probability
>60, Private, HS-grad, Never-married, Adm-clerical, Not-in-family, Black, Female,≤5000,≤40,<40, United-States, <=50K
25-60, Federal-gov, HS-grad, Married-spouse-absent, Handlers-cleaners, Not-in-family, White, Male,≤5000,≤40,<40, United-States, <=50K
25-60, Private, 12th, Divorced, Other-service, Not-in-family, White, Female,≤5000,≤40,40-60, United-States, <=50K
<25, Private, Some-college, Never-married, Tech-support, Not-in-family, White, Female,≤5000,≤40,<40, United-States, <=50K
>60, Private, HS-grad, Never-married, Adm-clerical, Not-in-family, White, Female,≤5000,≤40,<40, United-States, <=50K
25-60, Private, Doctorate, Widowed, Prof-specialty, Not-in-family, White, Female,>5000,≤40,40-60, United-States, >50K
