age,workclass,education,marital-status,occupation,relationship,race,sex,capital-gain,capital-loss,hours-per-week,native-country,Probability
>60, Private, 5th-6th, Married-civ-spouse, Machine-op-inspct, Wife, White, Female,≤5000,≤40,<40, Honduras, <=50K
25-60, Private, 12th, Married-civ-spouse, Craft-repair, Husband, White, Male,≤5000,≤40,<40, United-States, <=50K
25-60, Private, HS-grad, Married-civ-spouse, Exec-managerial, Husband, White, Male,≤5000,≤40,<40, United-States, <=50K
25-60, Local-gov, Bachelors, Married-civ-spouse, Prof-specialty, Husband, White, Male,≤5000,≤40,<40, United-States, >50K
25-60, Private, 10th, Married-civ-spouse, Craft-repair, Husband, White, Male,≤5000,≤40,<40, United-States, <=50K
25-60, Private, HS-grad, Never-married, Exec-managerial, Not-in-family, White, Female,≤5000,≤40,40-60, United-States, <=50K
