age,workclass,education,marital-status,occupation,relationship,race,sex,capital-gain,capital-loss,hours-per-week,native-country,Probability
25-60, Private, Assoc-voc, Separated, Adm-clerical, Not-in-family, White, Female,≤5000,≤40,<40, United-States, <=50K
25-60, Private, Assoc-voc, Divorced, Adm-clerical, Not-in-family, White, Female,≤5000,≤40,<40, United-States, <=50K
25-60, Private, Assoc-voc, Separated, Craft-repair, Not-in-family, White, Female,≤5000,≤40,<40, United-States, <=50K
25-60, Private, Assoc-voc, Divorced, Adm-clerical, Not-in-family, White, Female,≤5000,≤40,<40, United-States, <=50K
25-60, Private, Assoc-voc, Divorced, Adm-clerical, Not-in-family, White, Female,≤5000,≤40,<40, United-States, <=50K
25-60, Private, Assoc-voc, Separated, Other-service, Not-in-family, White, Female,≤5000,≤40,<40, United-States, <=50K
