age,workclass,education,marital-status,occupation,relationship,race,sex,capital-gain,capital-loss,hours-per-week,native-country,Probability
<25, Local-gov, 11th, Never-married, Adm-clerical, Own-child, White, Female,≤5000,≤40,<40, United-States, <=50K
<25, Private, Some-college, Never-married, Adm-clerical, Own-child, White, Female,≤5000,≤40,<40, United-States, <=50K
<25, Local-gov, 11th, Never-married, Adm-clerical, Own-child, Amer-Indian-Eskimo, Female,≤5000,≤40,<40, United-States, <=50K
>60, Private, 10th, Married-civ-spouse, Protective-serv, Husband, White, Male,≤5000,>40,<40, United-States, <=50K
25-60, Self-emp-inc, Assoc-voc, Married-civ-spouse, Exec-managerial, Husband, White, Male,≤5000,≤40,40-60, United-States, >50K
25-60, Federal-gov, HS-grad, Married-civ-spouse, Adm-clerical, Husband, White, Male,≤5000,≤40,<40, United-States, <=50K
