age,workclass,education,marital-status,occupation,relationship,race,sex,capital-gain,capital-loss,hours-per-week,native-country,Probability
25-60, Federal-gov, Bachelors, Never-married, Tech-support, Own-child, Black, Male,≤5000,≤40,<40, United-States, <=50K
25-60, Private, Bachelors, Married-civ-spouse, Exec-managerial, Husband, White, Male,≤5000,≤40,<40, United-States, >50K
25-60, Private, Bachelors, Never-married, Tech-support, Not-in-family, Black, Male,≤5000,≤40,<40, United-States, <=50K
25-60, Private, 11th, Never-married, Craft-repair, Not-in-family, White, Female,≤5000,≤40,<40, United-States, <=50K
25-60, Private, Bachelors, Never-married, Sales, Own-child, Black, Male,≤5000,≤40,<40, United-States, <=50K
25-60, Self-emp-not-inc, Bachelors, Never-married, Tech-support, Own-child, White, Male,≤5000,≤40,<40, United-States, <=50K
