age,workclass,education,marital-status,occupation,relationship,race,sex,capital-gain,capital-loss,hours-per-week,native-country,Probability
25-60, State-gov, 9th, Married-civ-spouse, Farming-fishing, Husband, White, Male,≤5000,≤40,<40, United-States, <=50K
<25, Private, Some-college, Married-civ-spouse, Prof-specialty, Husband, White, Male,≤5000,≤40,<40, United-States, <=50K
25-60, Private, HS-grad, Married-civ-spouse, Craft-repair, Husband, White, Male,≤5000,≤40,<40, United-States, <=50K
<25, Private, Some-college, Married-civ-spouse, Adm-clerical, Husband, White, Male,≤5000,≤40,<40, United-States, <=50K
25-60, State-gov, Bachelors, Married-civ-spouse, Adm-clerical, Husband, White, Male,≤5000,≤40,<40, United-States, <=50K
25-60, Private, 10th, Married-civ-spouse, Farming-fishing, Husband, White, Male,≤5000,≤40,<40, United-States, <=50K
