age,workclass,education,marital-status,occupation,relationship,race,sex,capital-gain,capital-loss,hours-per-week,native-country,Probability
25-60, Local-gov, HS-grad, Married-civ-spouse, Handlers-cleaners, Husband, Black, Male,≤5000,≤40,<40, United-States, <=50K
25-60, Private, 10th, Never-married, Handlers-cleaners, Other-relative, White, Male,≤5000,≤40,<40, United-States, <=50K
25-60, Local-gov, Bachelors, Married-civ-spouse, Prof-specialty, Wife, White, Female,≤5000,≤40,<40, United-States, >50K
25-60, Local-gov, Some-college, Married-civ-spouse, Handlers-cleaners, Husband, Black, Male,≤5000,≤40,<40, United-States, <=50K
25-60, Self-emp-inc, Bachelors, Married-civ-spouse, Prof-specialty, Husband, White, Male,≤5000,≤40,<40, United-States, >50K
<25, Private, HS-grad, Never-married, Transport-moving, Own-child, White, Male,≤5000,≤40,<40, United-States, <=50K
