age,workclass,education,marital-status,occupation,relationship,race,sex,capital-gain,capital-loss,hours-per-week,native-country,Probability
<25, Private, Bachelors, Never-married, Prof-specialty, Not-in-family, White, Male,≤5000,≤40,40-60, United-States, <=50K
25-60, Private, Some-college, Divorced, Prof-specialty, Not-in-family, White, Female,≤5000,≤40,<40, United-States, <=50K
25-60, Private, 12th, Married-civ-spouse, Machine-op-inspct, Husband, White, Male,≤5000,≤40,<40, United-States, <=50K
25-60, Private, HS-grad, Divorced, Other-service, Unmarried, Asian-Pac-Islander, Male,>5000,≤40,<40, Philippines, <=50K
25-60, Private, HS-grad, Married-civ-spouse, Transport-moving, Husband, White, Male,≤5000,≤40,<40, United-States, <=50K
25-60, Self-emp-not-inc, Assoc-acdm, Married-civ-spouse, Exec-managerial, Husband, White, Male,≤5000,≤40,40-60, United-States, >50K
