age,workclass,education,marital-status,occupation,relationship,race,sex,capital-gain,capital-loss,hours-per-week,native-country,Probability
25-60, Private, Assoc-acdm, Divorced, Tech-support, Not-in-family, White, Female,≤5000,≤40,<40, United-States, <=50K
25-60, Private, Some-college, Married-civ-spouse, Adm-clerical, Husband, White, Male,≤5000,≤40,<40, United-States, <=50K
25-60, Private, Assoc-acdm, Divorced, Tech-support, Unmarried, White, Female,≤5000,≤40,<40, United-States, <=50K
25-60, Private, HS-grad, Divorced, Tech-support, Not-in-family, White, Female,≤5000,≤40,<40, United-States, <=50K
25-60, Private, Some-college, Divorced, Tech-support, Not-in-family, White, Female,≤5000,≤40,<40, United-States, <=50K
25-60, Private, Assoc-acdm, Divorced, Handlers-cleaners, Not-in-family, White, Female,≤5000,≤40,<40, United-States, <=50K
