age,workclass,education,marital-status,occupation,relationship,race,sex,capital-gain,capital-loss,hours-per-week,native-country,Probability
25-60, Private, Some-college, Never-married, Farming-fishing, Not-in-family, White, Male,≤5000,≤40,<40, Peru, <=50K
25-60, Private, Some-college, Never-married, Adm-clerical, Not-in-family, White, Male,≤5000,≤40,<40, United-States, <=50K
25-60, Private, Some-college, Never-married, Adm-clerical, Not-in-family, White, Male,≤5000,≤40,<40, United-States, <=50K
25-60, Private, Bachelors, Married-civ-spouse, Handlers-cleaners, Husband, White, Male,≤5000,≤40,<40, United-States, <=50K
25-60, Private, Some-college, Never-married, Adm-clerical, Not-in-family, White, Male,≤5000,≤40,<40, United-States, <=50K
25-60, Private, 10th, Never-married, Farming-fishing, Not-in-family, White, Male,≤5000,≤40,<40, United-States, <=50K
