age,workclass,education,marital-status,occupation,relationship,race,sex,capital-gain,capital-loss,hours-per-week,native-country,Probability
25-60, State-gov, HS-grad, Divorced, Craft-repair, Own-child, White, Male,≤5000,≤40,<40, United-States, <=50K
25-60, Private, HS-grad, Divorced, Craft-repair, Own-child, White, Male,≤5000,≤40,<40, United-States, <=50K
>60, Private, 11th, Married-civ-spouse, Craft-repair, Husband, White, Male,≤5000,>40,<40, United-States, <=50K
25-60, State-gov, HS-grad, Married-civ-spouse, Craft-repair, Husband, White, Male,≤5000,≤40,<40, United-States, <=50K
25-60, Self-emp-not-inc, HS-grad, Divorced, Craft-repair, Own-child, White, Male,≤5000,≤40,<40, United-States, <=50K
25-60, Private, HS-grad, Divorced, Craft-repair, Own-child, White, Male,≤5000,≤40,<40, United-States, <=50K
