age,workclass,education,marital-status,occupation,relationship,race,sex,capital-gain,capital-loss,hours-per-week,native-country,Probability
<25, Private, 10th, Never-married, Sales, Unmarried, White, Female,≤5000,≤40,<40, United-States, <=50K
25-60, Private, Masters, Divorced, Exec-managerial, Not-in-family, White, Female,>5000,≤40,<40, United-States, >50K
25-60, Private, 1st-4th, Married-civ-spouse, Other-service, Husband, Asian-Pac-Islander, Male,≤5000,≤40,40-60, China, <=50K
25-60, Private, Bachelors, Married-civ-spouse, Sales, Husband, White, Male,≤5000,≤40,40-60, United-States, >50K
25-60, Local-gov, Assoc-voc, Married-civ-spouse, Exec-managerial, Husband, White, Male,≤5000,≤40,40-60, United-States, >50K
25-60, Private, Some-college, Married-civ-spouse, Exec-managerial, Husband, White, Male,≤5000,>40,40-60, United-States, >50K
