age,workclass,education,marital-status,occupation,relationship,race,sex,capital-gain,capital-loss,hours-per-week,native-country,Probability
25-60, Private, 5th-6th, Married-civ-spouse, Craft-repair, Husband, Other, Male,≤5000,≤40,40-60, Mexico, <=50K
25-60, Private, HS-grad, Never-married, Other-service, Not-in-family, White, Female,≤5000,≤40,<40, United-States, <=50K
25-60, Private, Bachelors, Married-civ-spouse, Machine-op-inspct, Husband, Asian-Pac-Islander, Male,≤5000,≤40,<40, Iran, <=50K
>60, Private, Bachelors, Married-civ-spouse, Prof-specialty, Husband, White, Male,≤5000,≤40,<40, United-States, <=50K
25-60, Private, Some-college, Married-civ-spouse, Craft-repair, Husband, White, Male,>5000,≤40,<40, United-States, >50K
>60, Self-emp-not-inc, Preschool, Married-civ-spouse, Craft-repair, Husband, White, Male,≤5000,≤40,<40, United-States, <=50K
