age,workclass,education,marital-status,occupation,relationship,race,sex,capital-gain,capital-loss,hours-per-week,native-country,Probability
>60, Self-emp-not-inc, 11th, Divorced, Other-service, Not-in-family, White, Female,≤5000,≤40,<40, United-States, <=50K
>60, Private, 11th, Divorced, Other-service, Not-in-family, White, Female,≤5000,≤40,<40, United-States, <=50K
25-60, Self-emp-not-inc, Bachelors, Divorced, Other-service, Not-in-family, White, Female,≤5000,≤40,<40, United-States, <=50K
25-60, Private, Some-college, Married-spouse-absent, Exec-managerial, Not-in-family, White, Female,≤5000,≤40,<40, United-States, <=50K
<25, Private, Some-college, Never-married, Exec-managerial, Own-child, White, Female,≤5000,≤40,<40, United-States, <=50K
>60, Private, Some-college, Divorced, Other-service, Not-in-family, White, Female,≤5000,≤40,<40, United-States, <=50K
