age,workclass,education,marital-status,occupation,relationship,race,sex,capital-gain,capital-loss,hours-per-week,native-country,Probability
25-60, Private, HS-grad, Divorced, Craft-repair, Own-child, White, Male,≤5000,≤40,<40, United-States, <=50K
25-60, Local-gov, Some-college, Divorced, Adm-clerical, Unmarried, White, Female,≤5000,≤40,<40, United-States, <=50K
<25, Private, Some-college, Married-civ-spouse, Adm-clerical, Husband, White, Male,≤5000,≤40,<40, United-States, <=50K
<25, Private, HS-grad, Never-married, Transport-moving, Own-child, White, Female,≤5000,≤40,<40, United-States, <=50K
25-60, Self-emp-inc, HS-grad, Married-civ-spouse, Craft-repair, Husband, White, Male,≤5000,≤40,<40, United-States, <=50K
25-60, Private, HS-grad, Never-married, Handlers-cleaners, Own-child, White, Male,≤5000,≤40,<40, United-States, <=50K
