age,workclass,education,marital-status,occupation,relationship,race,sex,capital-gain,capital-loss,hours-per-week,native-country,Probability
25-60, Private, Assoc-acdm, Never-married, Sales, Not-in-family, White, Male,≤5000,≤40,<40, United-States, <=50K
25-60, Private, Some-college, Married-civ-spouse, Adm-clerical, Wife, White, Female,≤5000,≤40,<40, United-States, <=50K
25-60, Private, 11th, Married-civ-spouse, Farming-fishing, Husband, White, Male,≤5000,≤40,<40, United-States, <=50K
25-60, Private, Masters, Married-civ-spouse, Exec-managerial, Husband, White, Male,≤5000,≤40,40-60, United-States, >50K
25-60, Private, Bachelors, Married-civ-spouse, Sales, Husband, White, Male,>5000,≤40,40-60, United-States, >50K
25-60, Private, Assoc-acdm, Divorced, Sales, Not-in-family, White, Male,≤5000,≤40,<40, United-States, <=50K
