age,workclass,education,marital-status,occupation,relationship,race,sex,capital-gain,capital-loss,hours-per-week,native-country,Probability
>60, Self-emp-not-inc, 10th, Married-civ-spouse, Farming-fishing, Husband, White, Male,≤5000,≤40,40-60, United-States, <=50K
<25, Private, Some-college, Never-married, Sales, Not-in-family, White, Male,≤5000,≤40,<40, United-States, <=50K
25-60, Private, Assoc-acdm, Never-married, Adm-clerical, Not-in-family, White, Male,≤5000,≤40,<40, United-States, <=50K
>60, Self-emp-not-inc, 7th-8th, Married-civ-spouse, Farming-fishing, Husband, White, Male,≤5000,≤40,40-60, United-States, <=50K
>60, Private, HS-grad, Married-civ-spouse, Adm-clerical, Husband, White, Male,≤5000,≤40,40-60, United-States, <=50K
25-60, Private, 10th, Married-civ-spouse, Adm-clerical, Wife, White, Female,≤5000,≤40,<40, United-States, <=50K
