age,workclass,education,marital-status,occupation,relationship,race,sex,capital-gain,capital-loss,hours-per-week,native-country,Probability
25-60, State-gov, Masters, Never-married, Adm-clerical, Not-in-family, Black, Female,≤5000,≤40,40-60, United-States, <=50K
25-60, State-gov, Masters, Never-married, Adm-clerical, Not-in-family, White, Female,≤5000,≤40,<40, United-States, <=50K
<25, Private, HS-grad, Never-married, Craft-repair, Not-in-family, White, Male,≤5000,≤40,<40, Puerto-Rico, <=50K
25-60, State-gov, Bachelors, Never-married, Adm-clerical, Not-in-family, Black, Female,≤5000,≤40,<40, United-States, <=50K
25-60, State-gov, Masters, Never-married, Protective-serv, Not-in-family, White, Female,≤5000,≤40,<40, United-States, <=50K
25-60, State-gov, Some-college, Never-married, Other-service, Not-in-family, Black, Female,≤5000,≤40,<40, United-States, <=50K
