age,workclass,education,marital-status,occupation,relationship,race,sex,capital-gain,capital-loss,hours-per-week,native-country,Probability
25-60, Private, 5th-6th, Married-civ-spouse, Craft-repair, Husband, White, Male,≤5000,≤40,<40, United-States, <=50K
<25, Private, 9th, Never-married, Craft-repair, Own-child, White, Male,≤5000,≤40,40-60, United-States, <=50K
25-60, Private, Bachelors, Never-married, Adm-clerical, Not-in-family, Black, Female,≤5000,≤40,<40, United-States, <=50K
<25, Private, HS-grad, Never-married, Adm-clerical, Own-child, White, Female,≤5000,≤40,<40, United-States, <=50K
25-60, Private, 10th, Married-civ-spouse, Craft-repair, Husband, White, Male,≤5000,≤40,<40, United-States, <=50K
25-60, Private, 10th, Married-civ-spouse, Craft-repair, Husband, White, Male,≤5000,≤40,<40, United-States, <=50K
