age,workclass,education,marital-status,occupation,relationship,race,sex,capital-gain,capital-loss,hours-per-week,native-country,Probability
25-60, Private, Masters, Divorced, Exec-managerial, Unmarried, White, Female,≤5000,≤40,<40, United-States, <=50K
25-60, Private, Masters, Divorced, Exec-managerial, Unmarried, White, Female,≤5000,≤40,<40, United-States, <=50K
25-60, Private, HS-grad, Separated, Craft-repair, Unmarried, White, Male,≤5000,≤40,<40, United-States, <=50K
25-60, Private, 10th, Divorced, Exec-managerial, Unmarried, White, Female,≤5000,≤40,<40, United-States, <=50K
25-60, Private, Masters, Divorced, Other-service, Unmarried, White, Female,≤5000,≤40,<40, United-States, <=50K
25-60, Private, Bachelors, Divorced, Exec-managerial, Unmarried, White, Female,≤5000,≤40,<40, United-States, <=50K
