age,workclass,education,marital-status,occupation,relationship,race,sex,capital-gain,capital-loss,hours-per-week,native-country,Probability
25-60, Self-emp-inc, Bachelors, Divorced, Sales, Not-in-family, White, Female,≤5000,≤40,40-60, United-States, <=50K
25-60, Private, Assoc-acdm, Married-civ-spouse, Exec-managerial, Husband, White, Male,≤5000,>40,40-60, United-States, >50K
25-60, Local-gov, HS-grad, Married-civ-spouse, Protective-serv, Wife, Black, Female,≤5000,≤40,>60, United-States, >50K
25-60, Federal-gov, Assoc-acdm, Divorced, Prof-specialty, Unmarried, Black, Female,≤5000,≤40,<40, United-States, <=50K
25-60, Federal-gov, Bachelors, Divorced, Prof-specialty, Not-in-family, White, Female,≤5000,≤40,40-60, United-States, <=50K
25-60, Private, Bachelors, Never-married, Sales, Not-in-family, White, Female,≤5000,≤40,40-60, United-States, <=50K
