age,workclass,education,marital-status,occupation,relationship,race,sex,capital-gain,capital-loss,hours-per-week,native-country,Probability
25-60, Private, HS-grad, Married-civ-spouse, Other-service, Other-relative, Asian-Pac-Islander, Female,≤5000,≤40,<40, Taiwan, <=50K
25-60, Private, HS-grad, Married-civ-spouse, Handlers-cleaners, Husband, White, Male,≤5000,≤40,<40, United-States, <=50K
25-60, Private, HS-grad, Married-civ-spouse, Handlers-cleaners, Husband, White, Male,≤5000,≤40,<40, United-States, <=50K
>60, Self-emp-not-inc, HS-grad, Married-civ-spouse, Prof-specialty, Husband, White, Male,≤5000,≤40,40-60, United-States, <=50K
25-60, Private, HS-grad, Married-civ-spouse, Other-service, Husband, Asian-Pac-Islander, Male,≤5000,≤40,<40, China, <=50K
25-60, Private, Assoc-acdm, Never-married, Adm-clerical, Not-in-family, White, Male,≤5000,≤40,<40, United-States, <=50K
