age,workclass,education,marital-status,occupation,relationship,race,sex,capital-gain,capital-loss,hours-per-week,native-country,Probability
<25, Private, Assoc-voc, Married-civ-spouse, Adm-clerical, Wife, White, Female,≤5000,≤40,<40, United-States, <=50K
<25, Private, Assoc-voc, Married-civ-spouse, Adm-clerical, Wife, White, Female,≤5000,≤40,<40, United-States, <=50K
<25, Private, Assoc-voc, Married-civ-spouse, Craft-repair, Wife, White, Female,≤5000,≤40,<40, United-States, <=50K
25-60, Private, 5th-6th, Divorced, Machine-op-inspct, Unmarried, White, Male,≤5000,≤40,<40, United-States, <=50K
<25, Private, HS-grad, Married-civ-spouse, Adm-clerical, Wife, White, Female,≤5000,≤40,<40, United-States, <=50K
<25, Private, Bachelors, Married-civ-spouse, Adm-clerical, Wife, White, Female,≤5000,≤40,<40, United-States, <=50K
