age,workclass,education,marital-status,occupation,relationship,race,sex,capital-gain,capital-loss,hours-per-week,native-country,Probability
25-60, Private, Bachelors, Never-married, Adm-clerical, Own-child, White, Male,≤5000,≤40,<40, United-States, <=50K
25-60, Private, Bachelors, Never-married, Exec-managerial, Own-child, White, Male,≤5000,≤40,<40, United-States, <=50K
25-60, Private, HS-grad, Never-married, Handlers-cleaners, Own-child, Asian-Pac-Islander, Male,≤5000,≤40,<40, United-States, <=50K
25-60, Private, Bachelors, Never-married, Exec-managerial, Own-child, White, Male,≤5000,≤40,<40, United-States, <=50K
25-60, Private, Bachelors, Never-married, Handlers-cleaners, Own-child, White, Male,≤5000,≤40,<40, United-States, <=50K
25-60, Private, Bachelors, Never-married, Sales, Own-child, White, Male,≤5000,≤40,<40, United-States, <=50K
