age,workclass,education,marital-status,occupation,relationship,race,sex,capital-gain,capital-loss,hours-per-week,native-country,Probability
25-60, Private, Assoc-acdm, Divorced, Adm-clerical, Unmarried, White, Female,≤5000,≤40,<40, United-States, <=50K
25-60, Private, Assoc-acdm, Divorced, Adm-clerical, Unmarried, White, Female,≤5000,≤40,<40, United-States, <=50K
25-60, Private, Assoc-acdm, Divorced, Prof-specialty, Unmarried, White, Female,≤5000,≤40,<40, United-States, <=50K
25-60, Private, Assoc-acdm, Divorced, Exec-managerial, Unmarried, White, Female,≤5000,≤40,<40, United-States, <=50K
25-60, Private, Assoc-acdm, Widowed, Adm-clerical, Unmarried, White, Female,≤5000,≤40,<40, United-States, <=50K
25-60, Private, Assoc-acdm, Divorced, Tech-support, Unmarried, White, Female,≤5000,≤40,<40, United-States, <=50K
