age,workclass,education,marital-status,occupation,relationship,race,sex,capital-gain,capital-loss,hours-per-week,native-country,Probability
25-60, Self-emp-not-inc, HS-grad, Married-civ-spouse, Farming-fishing, Husband, White, Male,≤5000,≤40,>60, United-States, <=50K
25-60, Self-emp-not-inc, Some-college, Married-civ-spouse, Other-service, Wife, White, Female,≤5000,≤40,<40, United-States, <=50K
>60, Private, HS-grad, Widowed, Transport-moving, Not-in-family, White, Male,≤5000,≤40,<40, United-States, <=50K
25-60, Private, Assoc-voc, Never-married, Adm-clerical, Not-in-family, White, Female,≤5000,≤40,<40, United-States, <=50K
25-60, Self-emp-not-inc, HS-grad, Married-civ-spouse, Farming-fishing, Husband, White, Male,≤5000,≤40,>60, United-States, <=50K
25-60, Self-emp-not-inc, Masters, Never-married, Sales, Not-in-family, White, Male,≤5000,≤40,40-60, United-States, <=50K
