age,workclass,education,marital-status,occupation,relationship,race,sex,capital-gain,capital-loss,hours-per-week,native-country,Probability
25-60, Private, 5th-6th, Married-civ-spouse, Other-service, Husband, White, Male,≤5000,≤40,<40, Mexico, <=50K
<25, Private, 5th-6th, Married-civ-spouse, Other-service, Husband, White, Male,≤5000,≤40,<40, Mexico, <=50K
25-60, Private, HS-grad, Never-married, Transport-moving, Own-child, White, Male,≤5000,≤40,<40, United-States, <=50K
25-60, Private, 5th-6th, Married-civ-spouse, Other-service, Husband, White, Male,≤5000,≤40,<40, Puerto-Rico, <=50K
<25, Private, Some-college, Never-married, Sales, Own-child, White, Female,≤5000,≤40,<40, United-States, <=50K
<25, Private, HS-grad, Married-civ-spouse, Other-service, Wife, White, Female,≤5000,≤40,<40, United-States, <=50K
