age,workclass,education,marital-status,occupation,relationship,race,sex,capital-gain,capital-loss,hours-per-week,native-country,Probability
25-60, Private, Some-college, Divorced, Other-service, Not-in-family, Black, Female,≤5000,≤40,<40, United-States, <=50K
25-60, Private, Some-college, Divorced, Machine-op-inspct, Not-in-family, Black, Female,≤5000,≤40,<40, United-States, <=50K
25-60, Private, Some-college, Divorced, Prof-specialty, Not-in-family, Black, Female,≤5000,≤40,<40, United-States, <=50K
25-60, Private, Masters, Divorced, Other-service, Not-in-family, Black, Female,≤5000,≤40,<40, United-States, <=50K
25-60, Private, Some-college, Divorced, Adm-clerical, Not-in-family, Black, Male,≤5000,≤40,<40, United-States, <=50K
25-60, Private, Some-college, Divorced, Other-service, Not-in-family, White, Female,≤5000,≤40,<40, United-States, <=50K
