age,workclass,education,marital-status,occupation,relationship,race,sex,capital-gain,capital-loss,hours-per-week,native-country,Probability
25-60, Private, Bachelors, Never-married, Exec-managerial, Own-child, White, Female,≤5000,≤40,40-60, United-States, <=50K
25-60, Private, Bachelors, Never-married, Exec-managerial, Own-child, White, Female,≤5000,≤40,<40, United-States, <=50K
25-60, Private, Some-college, Divorced, Sales, Not-in-family, White, Male,≤5000,≤40,<40, Outlying-US(Guam-USVI-etc), <=50K
25-60, Private, 5th-6th, Separated, Craft-repair, Not-in-family, Black, Male,≤5000,≤40,<40, United-States, <=50K
<25, Private, 11th, Never-married, Other-service, Own-child, White, Female,≤5000,≤40,<40, United-States, <=50K
25-60, Private, Bachelors, Never-married, Exec-managerial, Own-child, White, Male,≤5000,≤40,<40, United-States, <=50K
