age,workclass,education,marital-status,occupation,relationship,race,sex,capital-gain,capital-loss,hours-per-week,native-country,Probability
<25, Private, HS-grad, Married-civ-spouse, Transport-moving, Husband, White, Male,≤5000,≤40,40-60, United-States, <=50K
<25, Private, HS-grad, Married-civ-spouse, Transport-moving, Husband, White, Male,≤5000,≤40,40-60, United-States, <=50K
<25, Private, HS-grad, Married-civ-spouse, Transport-moving, Husband, White, Male,≤5000,≤40,<40, United-States, <=50K
<25, Private, 12th, Never-married, Other-service, Own-child, White, Male,≤5000,≤40,<40, United-States, <=50K
<25, Private, Some-college, Never-married, Prof-specialty, Not-in-family, White, Male,≤5000,≤40,<40, United-States, <=50K
<25, Private, Some-college, Never-married, Other-service, Not-in-family, White, Female,≤5000,≤40,<40, United-States, <=50K
