age,workclass,education,marital-status,occupation,relationship,race,sex,capital-gain,capital-loss,hours-per-week,native-country,Probability
25-60, Private, Bachelors, Divorced, Prof-specialty, Unmarried, White, Female,≤5000,≤40,40-60, United-States, <=50K
25-60, Self-emp-not-inc, HS-grad, Never-married, Sales, Not-in-family, White, Male,≤5000,≤40,40-60, United-States, <=50K
25-60, Private, Bachelors, Separated, Prof-specialty, Unmarried, White, Female,≤5000,≤40,40-60, United-States, <=50K
25-60, Private, Bachelors, Divorced, Prof-specialty, Unmarried, White, Female,≤5000,≤40,<40, United-States, <=50K
25-60, Private, Some-college, Married-spouse-absent, Prof-specialty, Not-in-family, Asian-Pac-Islander, Female,≤5000,≤40,<40, China, <=50K
25-60, Private, Bachelors, Divorced, Machine-op-inspct, Unmarried, White, Female,≤5000,≤40,<40, United-States, <=50K
