age,workclass,education,marital-status,occupation,relationship,race,sex,capital-gain,capital-loss,hours-per-week,native-country,Probability
25-60, State-gov, Bachelors, Never-married, Adm-clerical, Unmarried, White, Female,≤5000,≤40,<40, United-States, <=50K
25-60, State-gov, Bachelors, Never-married, Exec-managerial, Unmarried, White, Female,≤5000,≤40,<40, United-States, <=50K
25-60, State-gov, Bachelors, Never-married, Adm-clerical, Unmarried, Black, Female,≤5000,≤40,<40, United-States, <=50K
>60, Private, HS-grad, Widowed, Sales, Not-in-family, White, Female,≤5000,≤40,<40, United-States, <=50K
25-60, Local-gov, Bachelors, Never-married, Prof-specialty, Not-in-family, Black, Female,≤5000,≤40,<40, United-States, <=50K
25-60, State-gov, HS-grad, Never-married, Adm-clerical, Unmarried, White, Female,≤5000,≤40,<40, United-States, <=50K
