age,workclass,education,marital-status,occupation,relationship,race,sex,capital-gain,capital-loss,hours-per-week,native-country,Probability
25-60, Private, Some-college, Never-married, Sales, Not-in-family, White, Male,≤5000,≤40,>60, United-States, <=50K
25-60, Self-emp-not-inc, 7th-8th, Married-civ-spouse, Craft-repair, Husband, White, Male,≤5000,≤40,<40, United-States, <=50K
25-60, Private, HS-grad, Never-married, Sales, Other-relative, White, Male,≤5000,≤40,40-60, United-States, <=50K
25-60, Private, 10th, Never-married, Handlers-cleaners, Unmarried, White, Male,≤5000,≤40,<40, Mexico, <=50K
25-60, Private, Some-college, Never-married, Adm-clerical, Not-in-family, White, Female,≤5000,≤40,<40, United-States, <=50K
<25, Private, Some-college, Never-married, Sales, Own-child, White, Female,≤5000,≤40,<40, United-States, <=50K
