age,workclass,education,marital-status,occupation,relationship,race,sex,capital-gain,capital-loss,hours-per-week,native-country,Probability
25-60, Self-emp-inc, HS-grad, Never-married, Exec-managerial, Not-in-family, Black, Female,≤5000,≤40,<40, United-States, <=50K
25-60, Private, 12th, Divorced, Other-service, Not-in-family, White, Female,≤5000,≤40,40-60, United-States, <=50K
<25, Private, HS-grad, Never-married, Craft-repair, Not-in-family, White, Male,≤5000,≤40,<40, Puerto-Rico, <=50K
<25, Private, Some-college, Never-married, Tech-support, Not-in-family, White, Female,≤5000,≤40,<40, United-States, <=50K
25-60, Private, Masters, Married-civ-spouse, Adm-clerical, Husband, White, Male,≤5000,≤40,<40, United-States, >50K
25-60, Private, Bachelors, Never-married, Prof-specialty, Not-in-family, White, Female,≤5000,≤40,40-60, United-States, <=50K
