age,workclass,education,marital-status,occupation,relationship,race,sex,capital-gain,capital-loss,hours-per-week,native-country,Probability
25-60, Private, 11th, Never-married, Adm-clerical, Not-in-family, White, Female,≤5000,≤40,<40, United-States, <=50K
25-60, Private, HS-grad, Divorced, Machine-op-inspct, Not-in-family, White, Female,≤5000,≤40,<40, United-States, <=50K
25-60, Private, 11th, Never-married, Protective-serv, Not-in-family, White, Female,≤5000,≤40,<40, United-States, <=50K
25-60, Private, 11th, Divorced, Adm-clerical, Not-in-family, White, Female,≤5000,≤40,<40, United-States, <=50K
<25, Private, Assoc-voc, Married-civ-spouse, Craft-repair, Wife, White, Female,≤5000,≤40,<40, United-States, <=50K
25-60, Private, Bachelors, Never-married, Adm-clerical, Not-in-family, White, Female,≤5000,≤40,<40, United-States, <=50K
