age,workclass,education,marital-status,occupation,relationship,race,sex,capital-gain,capital-loss,hours-per-week,native-country,Probability
25-60, Private, Bachelors, Never-married, Other-service, Not-in-family, White, Male,≤5000,≤40,<40, United-States, <=50K
25-60, Private, HS-grad, Married-civ-spouse, Sales, Husband, White, Male,≤5000,≤40,40-60, United-States, <=50K
25-60, Self-emp-inc, Some-college, Married-civ-spouse, Sales, Husband, White, Male,≤5000,≤40,<40, United-States, <=50K
25-60, Private, Some-college, Divorced, Adm-clerical, Not-in-family, White, Male,≤5000,≤40,<40, United-States, <=50K
>60, Private, HS-grad, Widowed, Other-service, Not-in-family, White, Female,≤5000,≤40,<40, United-States, <=50K
25-60, Local-gov, Assoc-voc, Divorced, Transport-moving, Not-in-family, White, Male,≤5000,≤40,<40, United-States, <=50K
