age,workclass,education,marital-status,occupation,relationship,race,sex,capital-gain,capital-loss,hours-per-week,native-country,Probability
25-60, Private, Assoc-voc, Never-married, Sales, Not-in-family, Amer-Indian-Eskimo, Male,≤5000,≤40,40-60, United-States, <=50K
25-60, Private, Assoc-voc, Never-married, Sales, Not-in-family, Black, Male,≤5000,≤40,40-60, United-States, <=50K
25-60, Private, Assoc-voc, Divorced, Sales, Not-in-family, White, Male,≤5000,≤40,40-60, United-States, <=50K
25-60, Private, Bachelors, Never-married, Sales, Not-in-family, Amer-Indian-Eskimo, Male,≤5000,≤40,40-60, United-States, <=50K
25-60, Self-emp-inc, HS-grad, Married-civ-spouse, Sales, Husband, White, Male,≤5000,>40,40-60, United-States, >50K
25-60, Private, Assoc-voc, Divorced, Sales, Not-in-family, White, Male,≤5000,≤40,40-60, United-States, <=50K
